start,end,line
0:21:47.460,0:21:54.12,in the chronology of the story I because

0:21:51.690,0:21:55.98,I you know I have my little list and

0:21:54.120,0:21:57.57,often when I'm working on one scene I'll

0:21:55.980,0:21:59.13,think of another sin and I just write it

0:21:57.570,0:22:02.28,on another piece of paper like just

0:21:59.130,0:22:05.07,again a sentence settles kind of comment

0:22:02.280,0:22:08.82,yeah so I don't forget Oh what's up see

0:22:05.070,0:22:11.28,on this but so it's they're very the

0:22:08.820,0:22:13.80,process is really different it takes me

0:22:11.280,0:22:16.53,I like when a story is happening when

0:22:13.800,0:22:18.48,I'm getting that early draft comes

0:22:16.530,0:22:23.61,really fast I hate it I hate it I hate

0:22:18.480,0:22:26.55,it because it takes all my time I have

0:22:23.610,0:22:29.41,been known to cancel classes I'm sick

0:22:26.550,0:22:32.24,today sorry I can't come in today

0:22:29.410,0:22:35.61,[Laughter]

0:22:32.240,0:22:37.74,because I feel like I'm going to lose it

0:22:35.610,0:22:40.08,okay so I when you said it it's

0:22:37.740,0:22:42.00,happening it feels like like it's come

0:22:40.080,0:22:43.49,to you it's like I mean it's not like an

0:22:42.000,0:22:48.42,inspiration but it's just like

0:22:43.490,0:22:50.94,accumulation or so much is going on you

0:22:48.420,0:22:53.10,know I go out and I take a walk every

0:22:50.940,0:22:54.72,afternoon this apartment we actually

0:22:53.100,0:22:58.92,part my writing process to take a walk

0:22:54.720,0:23:01.86,in the afternoon and shut up I'm just

0:22:58.920,0:23:06.90,trying to walk the people are talking in

0:23:01.860,0:23:09.27,my head and so it's just it feels like

0:23:06.900,0:23:11.31,it's just kind of sits over powering

0:23:09.270,0:23:14.91,saying when I'm working on a story it

0:23:11.310,0:23:16.89,just comes over me and it wakes me up in

0:23:14.910,0:23:19.74,the morning people wake me up in the

0:23:16.890,0:23:22.37,morning they are chattering away is it

0:23:19.740,0:23:27.75,it's very unnerving

0:23:22.370,0:23:30.75,and I often push back at a story until I

0:23:27.750,0:23:32.82,am really sure that I have you know

0:23:30.750,0:23:36.12,quite a few of the building blocks in

0:23:32.820,0:23:38.70,place because otherwise it it just seems

0:23:36.120,0:23:41.46,like a struggle in a fight and it's

0:23:38.700,0:23:43.80,going to occupy it takes it takes me

0:23:41.460,0:23:48.21,about ten days of like ten hour days in

0:23:43.800,0:23:50.82,a row ten ten-hour day well it's for one

0:23:48.210,0:23:53.97,story for a story and this is all

0:23:50.820,0:23:58.17,hundred into yeah okay and it's just

0:23:53.970,0:24:00.14,incredible no I mean I'm I guess you're

0:23:58.170,0:24:04.07,saving a minute yeah I'm down

0:24:00.140,0:24:08.32,yeah but not with the hands with the

0:24:04.070,0:24:11.02,brains and then you know it's so much

0:24:08.320,0:24:13.52,because I don't I don't know how other

0:24:11.020,0:24:15.20,writers do this because I'm not writing

0:24:13.520,0:24:18.28,the scenes in order I'm kind of

0:24:15.200,0:24:21.11,deliberately writing them out of order

0:24:18.280,0:24:24.29,just I write the scene I see most

0:24:21.110,0:24:27.08,clearly in my mind first and not worry

0:24:24.290,0:24:29.24,about where it's going to go then then I

0:24:27.080,0:24:33.35,just put the whole thing away for a long

0:24:29.240,0:24:35.69,time that initial mess of a draft and

0:24:33.350,0:24:37.70,then worry later about kind of arranging

0:24:35.690,0:24:42.77,the scenes I'm often moving things

0:24:37.700,0:24:46.91,around not based on when they happened

0:24:42.770,0:24:48.62,but what's more interesting to come next

0:24:46.910,0:24:52.30,okay

0:24:48.620,0:24:54.16,and so when were you studying fiction as

0:24:52.309,0:24:56.36,well as poetry in your graduate school

0:24:54.169,0:25:00.35,or did when did you start to write these

0:24:56.360,0:25:02.75,stories well I was um I did take a

0:25:00.350,0:25:06.14,fiction writing class in grad school I

0:25:02.750,0:25:07.94,was in I was in the poetry group but we

0:25:06.140,0:25:11.99,had to take a fiction class and I was

0:25:07.940,0:25:13.76,terrible I was terrible at it because I

0:25:11.990,0:25:18.10,didn't have any sense of what made a

0:25:13.760,0:25:20.48,story yeah but when I started teaching

0:25:18.100,0:25:23.99,it's especially when I moved to Lake

0:25:20.480,0:25:26.41,Forest College I they thought well any

0:25:23.990,0:25:29.90,poet can teach fiction writing you know

0:25:26.419,0:25:31.46,it's debatable if we can get a fiction

0:25:29.900,0:25:34.28,writer who can teach poetry so they

0:25:31.460,0:25:37.39,hired thinking you know that I could

0:25:34.280,0:25:40.82,figure it out so I think I just

0:25:37.390,0:25:43.42,accidentally taught myself to write

0:25:40.820,0:25:46.28,fiction by trying to help my students

0:25:43.429,0:25:50.03,make their stories better and trying to

0:25:46.280,0:25:55.22,diagnose and what does this story need I

0:25:50.030,0:25:57.23,remember so many days walking to my

0:25:55.220,0:25:58.88,fiction writing class and trying to

0:25:57.230,0:26:02.03,think about what I was going to say to

0:25:58.880,0:26:04.46,this writer about her story you know how

0:26:02.030,0:26:08.54,to how to address its trouble

0:26:04.460,0:26:12.88,and I realized that I was internalizing

0:26:08.540,0:26:15.91,all of all this and then the first

0:26:12.880,0:26:19.42,time I got a sabbatical on I remember I

0:26:15.910,0:26:21.13,was driving into Chicago on a little for

0:26:19.420,0:26:23.17,a little adventure for the day and I'm

0:26:21.130,0:26:25.66,so happy I had the sabbatical I was

0:26:23.170,0:26:29.59,going to work on poems of course and I

0:26:25.660,0:26:32.08,got this idea for a story and I wrote I

0:26:29.590,0:26:32.92,remember I was just writing on my car

0:26:32.080,0:26:35.61,see fine

0:26:32.920,0:26:38.44,driving this this little note to myself

0:26:35.610,0:26:40.66,about what the story kind of just a

0:26:38.440,0:26:43.54,synopsis like one sentence of what it

0:26:40.660,0:26:48.67,would be by the time I got into Chicago

0:26:43.540,0:26:50.89,I had five story synopses written on

0:26:48.670,0:26:52.96,this piece of paper well and then I just

0:26:50.890,0:26:56.11,came home and that's when I did from my

0:26:52.960,0:26:58.96,own radical I will I will a bunch of

0:26:56.110,0:27:01.95,stories analysis first book of stories

0:26:58.960,0:27:06.73,limited lifetime warranty is called yeah

0:27:01.950,0:27:14.59,and what year was it oh my gosh I think

0:27:06.730,0:27:15.01,that was 1983 yourself and so so

0:27:14.590,0:27:18.40,southern

0:27:15.010,0:27:19.72,Anna's and so you've been stories kind

0:27:18.400,0:27:21.64,of happened to you and they've done

0:27:19.720,0:27:25.27,they've been similar as a whole time in

0:27:21.640,0:27:27.25,writing have poems in similar ways had

0:27:25.270,0:27:29.32,like kind of come upon you or is it a

0:27:27.250,0:27:31.69,little bit more I don't know is it a

0:27:29.320,0:27:34.93,different process than that holes are

0:27:31.690,0:27:42.16,more like a daily practice with me I

0:27:34.930,0:27:48.18,like I like poems they don't form either

0:27:42.160,0:27:51.40,more about sound and imagery voice who's

0:27:48.180,0:27:58.00,talking in my poems there's there often

0:27:51.400,0:28:03.46,some part of me that I didn't really

0:27:58.000,0:28:06.15,know was there you know some aspect of

0:28:03.460,0:28:09.13,personality that I'm kind of exploring

0:28:06.150,0:28:12.69,yeah who uses language a different way

0:28:09.130,0:28:17.11,maybe than my ordinary daily life self

0:28:12.690,0:28:22.54,so I like I like that kind of quick pop

0:28:17.110,0:28:24.73,of a poem and you start mostly with the

0:28:22.540,0:28:32.33,line or name

0:28:24.730,0:28:36.77,I like a line with an image in it okay I

0:28:32.330,0:28:39.35,like one time I was writing an article

0:28:36.770,0:28:42.08,about Charles writes poetry I really

0:28:39.350,0:28:44.51,like Charles Wright and I said something

0:28:42.080,0:28:49.25,in there and yes with you about the hand

0:28:44.510,0:28:52.54,of the image in the glove of sound and I

0:28:49.250,0:28:54.16,took that out over the review because I

0:28:52.549,0:28:57.28,thought it sound a little precious or

0:28:54.169,0:29:00.47,something but it reduces yeah

0:28:57.289,0:29:03.64,but for me I like that kind of fear sort

0:29:00.470,0:29:11.92,of in sort of indivisible great right

0:29:03.649,0:29:14.45,they come together but I'm I'm I

0:29:11.929,0:29:16.97,remember talking to Charles one time and

0:29:14.450,0:29:19.85,I asked him a lot of the same questions

0:29:16.970,0:29:22.13,you're asking me about composition I was

0:29:19.850,0:29:24.86,just like taken aback to the airport

0:29:22.130,0:29:26.48,after a reading I like plug in him for

0:29:24.860,0:29:28.39,everything you can tell me about how he

0:29:26.480,0:29:31.85,works and he says well you know after I

0:29:28.399,0:29:37.52,do it to your fourth draft and I I turn

0:29:31.850,0:29:39.67,it over to my ear yeah he said I drive

0:29:37.520,0:29:42.28,around town doing errands going to

0:29:39.679,0:29:44.65,stores stuff like that and I memorized

0:29:42.289,0:29:47.51,the poem and working on and then I just

0:29:44.659,0:29:50.39,start moving the words in the lines

0:29:47.510,0:29:52.37,around and then I start moving the lines

0:29:50.390,0:29:54.50,and the stances around just kind of

0:29:52.370,0:30:00.20,trying out I'm listening to the sonic

0:29:54.500,0:30:02.63,value I'm doing that so I guess that's a

0:30:00.200,0:30:04.49,good space to move on to review I mean

0:30:02.630,0:30:08.99,so when you're revising a poem are you

0:30:04.490,0:30:11.09,revising mostly by sound or I mean it's

0:30:08.990,0:30:17.21,like the sonic values is that where are

0:30:11.090,0:30:20.11,there different stages well you know

0:30:17.210,0:30:25.88,every poem has just presents different

0:30:20.110,0:30:27.89,troubles to me I guess these are some of

0:30:25.880,0:30:29.53,the questions I have to ask myself if

0:30:27.890,0:30:31.07,this is just for me I don't know that

0:30:29.539,0:30:34.97,these would be other people's problems

0:30:31.070,0:30:36.32,by any means but I'm asking myself who

0:30:34.970,0:30:41.01,the heck is talking

0:30:36.320,0:30:44.94,who is it because sometimes I just and I

0:30:41.010,0:30:48.45,mean that in a physical literal way I

0:30:44.940,0:30:51.54,have to see I have to see a figure

0:30:48.450,0:30:53.88,almost you know maybe it's me but it's

0:30:51.540,0:30:58.11,me when I'm 1,
0:30:53.880,0:31:01.77,it's me with big red hair it's another

0:30:58.110,0:31:02.46,so I'm asking who is this person where

0:31:01.770,0:31:08.64,is she

0:31:02.460,0:31:12.96,are he sometimes I think I'm in a kind

0:31:08.640,0:31:15.27,of gender shift I like that because I

0:31:12.960,0:31:17.40,was a real tomboy as a little kid and I

0:31:15.270,0:31:19.80,think I kind of squashed that little

0:31:17.400,0:31:21.33,tomboy down and he likes to come back

0:31:19.800,0:31:24.12,and say things once in a while and he's

0:31:21.330,0:31:32.28,a little bit of a sassy smadi kid and I

0:31:24.120,0:31:36.36,like him so who is she where are we in

0:31:32.280,0:31:38.30,the poem I need to get located in

0:31:36.360,0:31:43.94,time-space

0:31:38.300,0:31:47.43,and what the heck is going on like what

0:31:43.940,0:31:50.25,dramatically is happening in the poem

0:31:47.430,0:31:52.56,and a lot of times I'm you know I'll

0:31:50.250,0:31:57.93,have a fix on one or the other of these

0:31:52.560,0:31:59.76,questions but I'm really feeling unclear

0:31:57.930,0:32:02.79,about the other so I kind of know

0:31:59.760,0:32:05.24,questions to ask myself and that's what

0:32:02.790,0:32:07.68,I do in there really early stages of

0:32:05.240,0:32:10.77,drafting the poem and trying to figure

0:32:07.680,0:32:12.51,out the answers to some of those and how

0:32:10.770,0:32:14.21,do these questions then translate into

0:32:12.510,0:32:15.90,like into the basic physical

0:32:14.210,0:32:17.55,manifestation of your writing are you

0:32:15.900,0:32:20.55,are you still in your notebooks working

0:32:17.550,0:32:23.01,yeah okay yeah fill in notebooks and are

0:32:20.550,0:32:25.41,you writing these questions in no now

0:32:23.010,0:32:29.37,I'm just what I'm doing is I'm just

0:32:25.410,0:32:32.46,getting my imagination a chore a task

0:32:29.370,0:32:34.68,instead I'm staring into space and

0:32:32.460,0:32:38.66,trying to see like where's the set where

0:32:34.680,0:32:40.65,is this unfolding trying to give myself

0:32:38.660,0:32:42.33,I'm so I'm interested in all this

0:32:40.650,0:32:44.64,material and I remember let's say you're

0:32:42.330,0:32:46.68,a poet but I mean it's also like you

0:32:44.640,0:32:48.72,knows it so you haven't so much up here

0:32:46.680,0:32:49.04,just that it doesn't happen on on the

0:32:48.720,0:32:50.63,page

0:32:49.049,0:32:52.88,doesn't happen it happens a lot yeah

0:32:50.639,0:32:54.45,going to the store and thinking about

0:32:52.889,0:32:57.98,for listening to me of your own sound

0:32:54.450,0:33:02.42,this is another hard things dr. Porter

0:32:57.980,0:33:04.32,yeah and see none of this takes place

0:33:02.429,0:33:07.04,with fictional fiction you're sort of

0:33:04.320,0:33:10.47,that you've got all that as you walk

0:33:07.049,0:33:12.17,into the first thing great great well

0:33:10.470,0:33:14.46,then so so what is your mode when you're

0:33:12.179,0:33:16.75,advising a story like how do you how do

0:33:14.460,0:33:21.23,you work through the drafts of the story

0:33:16.759,0:33:24.89,well with a story I'm really thinking a

0:33:21.239,0:33:28.87,lot more about why does this happen or

0:33:24.899,0:33:30.98,why did this happen in the past tense

0:33:28.879,0:33:31.35,actually have a lot of questions

0:33:30.989,0:33:35.36,thoughts

0:33:31.350,0:33:37.37,motivations of the characters or what

0:33:35.369,0:33:40.32,their relationships are like how did

0:33:37.379,0:33:42.45,they get to this I'm often trying to

0:33:40.320,0:33:46.25,think about a little some details of

0:33:42.450,0:33:50.09,backstory you know again you know all

0:33:46.259,0:33:52.83,these things it's really helped to have

0:33:50.090,0:33:55.54,heard myself ask my students these

0:33:52.830,0:33:59.27,questions for the last 30 years yeah

0:33:55.549,0:34:03.33,they're kind of in there this is yeah

0:33:59.279,0:34:07.59,the questions to ask yourself and but I

0:34:03.330,0:34:10.64,think what I'm mainly doing once I have

0:34:07.590,0:34:13.70,addressed some of these questions I mean

0:34:10.649,0:34:17.87,we have to do with inferiority and

0:34:13.700,0:34:21.00,psychology of people is in revision I'm

0:34:17.879,0:34:23.90,just trying to get the story to move

0:34:21.000,0:34:28.13,along I'm really paying most attention

0:34:23.909,0:34:31.04,to the pace and I think in that regard

0:34:28.139,0:34:34.98,now poetry and fiction maybe have a

0:34:31.049,0:34:37.88,little more similarities when you get to

0:34:34.980,0:34:40.29,that stage of revision where you're

0:34:37.889,0:34:42.29,starting to really start to tighten yeah

0:34:40.290,0:34:46.66,are we there now what that was talking

0:34:42.299,0:34:53.25,about no yes okay your bands so then

0:34:46.669,0:34:57.96,with the poem I flash mercilessly I'm a

0:34:53.250,0:34:59.81,slasher yes and I move things around but

0:34:57.960,0:35:02.97,often when I'm moving around is you know

0:34:59.819,0:35:06.34,I've got too many lines on

0:35:02.970,0:35:09.01,the landscape all in a row here I've got

0:35:06.340,0:35:11.71,ten lines about a freaking place where

0:35:09.010,0:35:13.93,we are the best boring but I sometimes I

0:35:11.710,0:35:16.42,won't cut them I'll just take four of

0:35:13.930,0:35:18.87,them and put them in a different place

0:35:16.420,0:35:22.21,and I don't worry too much about like

0:35:18.870,0:35:25.60,how to get back there because that's

0:35:22.210,0:35:27.46,easy to do later and same in fiction

0:35:25.600,0:35:30.90,what I'm really thinking about pacing

0:35:27.460,0:35:34.44,I'm thinking about you know like the

0:35:30.900,0:35:38.05,opening of the story I'll just start

0:35:34.440,0:35:40.60,with the scene that we're going to catch

0:35:38.050,0:35:41.98,back up to in the middle but because

0:35:40.600,0:35:43.45,it's got some interest I think

0:35:41.980,0:35:44.80,interesting dialogue or something

0:35:43.450,0:35:47.02,interesting is going on with the

0:35:44.800,0:35:50.08,characters I'm going to start there and

0:35:47.020,0:35:52.63,then circle back and then catch back up

0:35:50.080,0:35:54.28,to it midway through the story oh and

0:35:52.630,0:35:57.73,you're for that same cut that's typical

0:35:54.280,0:35:59.23,for me to UM move around like that so

0:35:57.730,0:36:01.75,I'm just going okay we've got a scene a

0:35:59.230,0:36:03.61,dialogue now we're going to have you

0:36:01.750,0:36:06.28,know how to dissolve start now we're

0:36:03.610,0:36:08.44,going to have scene where we've got some

0:36:06.280,0:36:10.83,dream or some thinking that we're going

0:36:08.440,0:36:17.41,to go back to dialog so I'm just kind of

0:36:10.830,0:36:19.03,having some syncopation of pacing things

0:36:17.410,0:36:20.53,and that kind of happens throughout your

0:36:19.030,0:36:22.03,books to write not if not only within

0:36:20.530,0:36:25.38,the story hood within a collection of

0:36:22.030,0:36:25.38,stories there's sort of that same

0:36:25.980,0:36:30.52,disadvantages of such as it seems or not

0:36:29.020,0:36:33.19,not repetition but like a kind of

0:36:30.520,0:36:34.75,allusion to the same places and time and

0:36:33.190,0:36:37.03,space

0:36:34.750,0:36:38.59,so I guess is that when you are when

0:36:37.030,0:36:40.30,you're revising the entire book is that

0:36:38.590,0:36:42.85,when you're putting together the book

0:36:40.300,0:36:47.53,itself is that also happening yeah okay

0:36:42.850,0:36:53.86,okay so have these two modes of revision

0:36:47.530,0:36:55.84,that sort of focus on pacing and moving

0:36:53.860,0:36:57.76,around any changes how they changed over

0:36:55.840,0:36:58.96,the course of your career I mean did you

0:36:57.760,0:37:00.91,like when you were first starting out

0:36:58.960,0:37:03.76,writing did you have to come to this

0:37:00.910,0:37:07.24,kind of way of revising or it did just

0:37:03.760,0:37:12.01,what was it there from the beginning no

0:37:07.240,0:37:13.84,it's been a slow gradual process in the

0:37:12.010,0:37:14.18,beginning was was there a different kind

0:37:13.840,0:37:16.55,of way

0:37:14.180,0:37:19.70,more you know we're doing it more

0:37:16.550,0:37:23.48,by-the-book kind of speaker was it oh

0:37:19.700,0:37:25.40,gosh I don't I don't know how I was

0:37:23.480,0:37:27.86,doing anything at the beginning I know

0:37:25.400,0:37:28.85,you know what my first book of poems I

0:37:27.860,0:37:33.11,had help

0:37:28.850,0:37:35.15,I've never had an editor again yeah like

0:37:33.110,0:37:36.89,I had with that very first book Larry

0:37:35.150,0:37:38.39,Lieberman at University of Illinois

0:37:36.890,0:37:41.45,press

0:37:38.390,0:37:44.93,he weeded out some of the weaker poems

0:37:41.450,0:37:47.83,but also helped me to shape up some new

0:37:44.930,0:37:50.75,things I was working on and put them in

0:37:47.830,0:37:52.52,help me with the arrangement and you

0:37:50.750,0:37:55.10,know I've never had help like that again

0:37:52.520,0:37:58.34,but that was very instructive yeah Kimmy

0:37:55.100,0:38:00.83,yeah he would write me these interesting

0:37:58.340,0:38:02.69,little letters were you explained you

0:38:00.830,0:38:05.30,know why he thought this article here

0:38:02.690,0:38:09.38,and this go there and this stanza needed

0:38:05.300,0:38:11.51,to be gone this was stupid it was just

0:38:09.380,0:38:13.64,so helpful to have somebody be such a

0:38:11.510,0:38:16.37,close reader with the scene I said if

0:38:13.640,0:38:18.41,you ever had them again ever so so do

0:38:16.370,0:38:19.79,people play a role in your revision

0:38:18.410,0:38:22.97,process now or is it pretty much just

0:38:19.790,0:38:25.19,you um well my husband reads everything

0:38:22.970,0:38:29.27,and he's really really tough critic

0:38:25.190,0:38:35.09,really really tough it's very good but

0:38:29.270,0:38:39.23,he I think he's smart reader and he also

0:38:35.090,0:38:42.77,kind of knows what I'm capable of and if

0:38:39.230,0:38:46.52,I don't measure up he'll tell me yes

0:38:42.770,0:38:50.59,yeah so you don't all right you're not

0:38:46.520,0:38:54.59,corresponding with other writers I have

0:38:50.590,0:38:59.68,I have a couple of good fiction writer

0:38:54.590,0:39:03.76,friends that I have shared work with and

0:38:59.680,0:39:07.34,another a novel I had a two book

0:39:03.760,0:39:09.74,contract this is the book of stories

0:39:07.340,0:39:12.38,before this one and they wanted the

0:39:09.740,0:39:13.61,second thing to be a novel the publisher

0:39:12.380,0:39:16.67,I told you who decided they were going

0:39:13.610,0:39:19.07,to quit this is fiction and they wanted

0:39:16.670,0:39:22.39,the second book to be a novel so I I

0:39:19.070,0:39:26.69,tried three times to write a novel and I

0:39:22.390,0:39:29.45,got two hundred pages in three times

0:39:26.690,0:39:32.24,yeah and I showed a couple of those

0:39:29.450,0:39:37.46,books to friends who are fiction writers

0:39:32.240,0:39:39.14,and they they confirmed for me that what

0:39:37.460,0:39:42.14,I thought was true the way I could

0:39:39.140,0:39:47.54,phrase it to myself is they didn't have

0:39:42.140,0:39:52.85,a big enough engine I like a short story

0:39:47.540,0:39:56.08,I'm I like to go cut I like short

0:39:52.850,0:39:58.82,stories - I was struck though in quake

0:39:56.080,0:40:00.05,right but like I was I was reading that

0:39:58.820,0:40:02.57,and I thought it was I mean it read to

0:40:00.050,0:40:05.00,me and helps me a lot like the way that

0:40:02.570,0:40:06.77,Jennifer Egan is explaining we do love

0:40:05.000,0:40:09.08,working out in like separate stories but

0:40:06.770,0:40:12.20,all kind of like it's an investigating

0:40:09.080,0:40:13.70,certain kind of dilemmas and an

0:40:12.200,0:40:17.45,interesting kind of metaphorical

0:40:13.700,0:40:19.70,noticeable is well thank you I was that

0:40:17.450,0:40:21.02,good positive yes yeah with that but I

0:40:19.700,0:40:22.31,was like I mean like what did she call

0:40:21.020,0:40:24.74,this or not I mean I just was wondering

0:40:22.310,0:40:26.60,you know it's not anyway it's just such

0:40:24.740,0:40:29.42,a there's very arbitrary but I think I

0:40:26.600,0:40:31.07,can compose them very much separately

0:40:29.420,0:40:33.35,I mean that they are related right and

0:40:31.070,0:40:35.84,amazing yeah they're weak stories yeah

0:40:33.350,0:40:38.15,they've all been linked yes I really I

0:40:35.840,0:40:42.35,love all the different possibilities of

0:40:38.150,0:40:46.01,ways to link stories but in terms of the

0:40:42.350,0:40:49.28,engine yeah I like a little small engine

0:40:46.010,0:40:53.60,that I feel like I can I can fix what's

0:40:49.280,0:40:56.57,wrong with a little small engine and I

0:40:53.600,0:40:59.15,don't know if I could the novel thing

0:40:56.570,0:41:02.87,it's kind of overwhelming for me to

0:40:59.150,0:41:05.42,think about yeah how much you have to

0:41:02.870,0:41:09.29,sustain how much should have how much

0:41:05.420,0:41:11.99,needs to drive a big novel and I love

0:41:09.290,0:41:17.18,novels I was really none but I'm

0:41:11.990,0:41:19.55,intimidated by the arc how huge it needs

0:41:17.180,0:41:25.36,to be and how much maybe you need to

0:41:19.550,0:41:28.22,know before you sit down right there

0:41:25.360,0:41:29.60,writing a tale any sort of research or

0:41:28.220,0:41:32.27,circle or otherwise

0:41:29.600,0:41:34.37,yeah like quake was a good example I

0:41:32.270,0:41:36.41,love doing all that research on the

0:41:34.370,0:41:38.33,gypsy culture in the country I just

0:41:36.410,0:41:40.73,loved it oh yeah

0:41:38.339,0:41:42.53,and that just really fed my story so I

0:41:40.739,0:41:45.59,was looking on it and there's new books

0:41:42.539,0:41:48.56,that has a dinosaur dig in it that was

0:41:45.599,0:41:52.22,really fun meet my husband I went on the

0:41:48.569,0:41:54.39,dig in Montana as part of the research

0:41:52.229,0:41:57.26,for that fun made especially they just

0:41:54.390,0:41:58.85,have that like dinosaur versus dinosaur

0:41:57.269,0:42:00.66,discovery or something this summer could

0:41:58.859,0:42:02.78,you see this formed with like some

0:42:00.660,0:42:07.31,private invest in private digger found

0:42:02.789,0:42:09.26,these like perfectly preserved fossils

0:42:07.319,0:42:11.03,of like a Tyrannosaurus Rex worth like a

0:42:09.269,0:42:12.50,Stegosaurus like right next to

0:42:11.039,0:42:14.81,tremendous oh that that you made fight

0:42:12.509,0:42:16.58,and so they stole it and like I said wow

0:42:14.819,0:42:18.68,there's only big folded adoption for

0:42:16.589,0:42:20.81,some ridiculous price really sort of the

0:42:18.689,0:42:22.82,debate about this just like a couple of

0:42:20.819,0:42:26.09,Famers or something a couple of like

0:42:22.829,0:42:29.09,hold the whole week creatures Wow didn't

0:42:26.099,0:42:32.33,sleep and insane fine in Montana you

0:42:29.099,0:42:34.41,know and that's right well what I

0:42:32.339,0:42:37.38,understood was that on this is

