original,line
628,from complete strangers I got another
629,from Italy and Italy England I'll just
630,from Montana and this was a gift from
631,from the Army in 1971 got drafted went
632,from the handwritten text to the to the
633,from the hard drive just get rid of them
634,from words or phrases or images or
635,front of the are the ones that I'm that
636,frustration yeah you know this is
637,fuck probably fine you are you're going
638,fundamental way I'm looking for clarity
639,gave a reading in a Writers Conference
640,general and how that's changed over the
641,general or enemy certainly sound figures
642,general overview where he were right
643,generally and I've got it kind of broken
644,generative
645,gesture than the email is yeah I kind of
646,get halfway into it or I'll get 13 lines
647,get her to apply to go to the castle at
648,get means like I know before the
649,get the idea how did you pre write if
650,gets me started
651,getting out into the what else you call
652,gift and get in the way but I'm not I'm
653,give Zoo well we're not going to make
654,go back 25 years and pull out a notebook
655,go back in and pull them out I mean it
656,go back mainly because I'm having it
657,go but you might want to consider just
658,go to work on it and then so that the
659,goes in the box so I try to try not to
660,goes into the computer is the kind of
661,going back there how where were you we
662,going on to the year and you know it's
663,going to be when I have this sort of
664,going to change publishers when I second
665,going to happen yeah so alright good guy
666,going to pay me anything from my
667,going to to find a way to connect with
668,going to work what it's going to revolve
669,gone basically because I hear a
670,gonna get ya let me see here okay this
671,good in letters too as well as in poems
672,good luck I mean I think it'd be really
673,got it's got metal in here ooh this
674,got like a job and stuff too
675,got stuff in the cloud and I got stuff
676,got that I'd have to plug it into it it
677,got the poems now I can read them
678,got the study with Madeleine DeFries
679,got to be a combination of the two even
680,got to have something okay
681,got to ship them all
682,granites
683,great and did the BBC interview and did
684,great break it into a different number
685,great opportunity penguin wants to
686,great pedagogical tool that way um hey
687,guess doing the best I can and if we
688,guess what sort of mode is your revision
689,guys I think I've exhausted it Oh unless
690,had a whole lot of use for poetry I took
691,had been published in magazines say and
692,had done such good work it's kind of
693,had this 3/4 terabyte hard drive that
694,had to scrounge around for a pen to sign
695,handwriting became something I did that
696,handwritten page numbers on it when I
697,happened although the first film I ever
698,happened first but I got to working on
699,happens to be handwritten and old
700,harbor but I've never come and you can
701,hard can it be doesn't have to go very
702,hard copy somehow and and look at them
703,hard drive back when I had a PC I had an
704,hard so I had to do a lot of penciling
705,harddrive I think I nearly filled it up
706,has been entirely electronic all these
707,has changed over the course of years
708,hasn't worked that way for me that was
709,hate to revise it's like hating writing
710,have a couple of I have a couple of
711,have a good sense of your writing
712,have a we have a hot tub Oh which is one
713,have a year on them or a period of years
714,have anything occurs for most of it yeah
715,have done it probably I would have done
716,have I mean I've got like exactly
717,have not but did you have any
718,have something called the rule of the
719,have the thing I thought was best about
720,have this tray down here this wooden
721,have to do with the frost it'll have to
722,have to love to revise because that's
723,have to plug it into a PC somewhere
724,have what we'll see see how because it
725,have you been writing in this spot I
726,having that poem broken into turrets
727,Hawthorn and Rachelle has been there oh
728,he he's TC Boyle's editor Paul slovic
729,he never really had the belly for the
730,he says and then they send me a contract
731,helped me see that you just said no
732,her but you know knopf insisted you got
733,her students I mean she was doing it
734,her the NSA must have a file five feet
735,here he wants to move copies in because
736,here just did that look at it go
737,here since then basically in the same
738,here this
739,he's a prose writer though they lose
740,he's not going to tell you I got
741,hilarious because he's very funny
742,hired here I published dragon snakes
743,his brother Jesus Christ who was born
744,his widow so it's what I put on whatever
745,hole great great no this is here we have
746,honey there's a big question mark but
747,hornet's nest about the so around up in
748,hours just just kind of messing around
749,how does that sort of change your
750,how I could have done without the
751,how that came about
752,how this come take me seriously well I
753,how this goes into a book and everything
754,how to get going I know how to get out
755,however one pronounces that I can never
756,Hugo would say is needs to you need to
757,hundred lines at a time and I got to go
758,hundred lines long in barely drafts and
759,hundred some-odd lines long this
760,hurry yeah although Random House is now
761,I at some point this winter I need to
762,I buy I think I may be part of the
763,I can promise to have this book
764,I can't guarantee that I won't be boring
765,I come out here um well I'm one to talk
766,I convinced them that I should have a
767,I could I could immediately just look at
768,I decide that that's done then again it
769,I did I think however when I when I
770,I did I was interviewed by a young woman
771,I did the selected poems both here and
772,I didn't finish this one what slips it
773,I didn't have much luck I didn't have
774,I do and I miss let's see I got that's a
775,I do I have I have this which is sort of
776,I don't I don't I don't have that kind
777,I don't know it's something that I
778,I don't organize them but I look for
779,I find something in this batch before it
780,I got to start on what I'm working on
781,I got ya I got sort of I got sort of
782,I guess we sort of talked about this but
783,I had a Poetry Festival which was
784,I had I had an IBM Selectric I guess
785,I had this one poem which was actually
786,I hate using the word idea though
787,I have this weekend writer-in-residence
788,I hope you can hear that insult yeah
789,I kind of like something about them all
790,I knew something was missing but I
791,I love Dryden I love Pope but I can only
792,I mean I'd every time I get through a
793,I mean people ask me now are you working
794,I mean you know you it was you were what
795,I need to I need to develop that spot I
796,I need you to put in or I've taken out
797,I sent it to Dorian and Henry and Phil
798,I think extraordinary is a big bug
799,I think I mean it changes in a sort of I
800,I think I said the me mail so it every
801,I think I was I'm less concerned with
802,I think it fell down was an enormous
803,I think it's good I'm on sabbatical
804,I think it's one of the reasons that
805,I think much to their detriment both on
806,I think so it's I mean I did I don't I
807,I think that I discovered or realized
808,I think that was one of the interesting
809,I think the Brits appreciated that too
810,I think there was one huge sort of shift
811,I want to I want to say to those things
812,I want to use the word organic here was
813,I wanted it but the first poem in the
814,I when I finished it I knew what I
815,I wondered about well what am I missing
816,I wrote a lot of letters letters were
817,I wrote that that book and that was the
818,I'd like to deliver in spring 2012 okay
819,I'd never wanted him to hear me say that
820,I'd play Dylan Thomas on on the sand I
821,idea
822,idea of being able to communicate
823,idea what book it is I'm reaching for
824,ideas where because they tend not to
825,idiot let me find it
826,idiotic right
827,if I had them organized in some way but
828,if I missed anything that there's some
829,if you got any time between 2:00 and
830,if you when do you consider a piece of
831,ignorant of me there are prose poems I
832,I'll be fine
833,I'll do this on on computer yeah this
834,I'll fiddle with
835,I'll just have an asterisk and seven
836,I'll sit down I'll spend the first two
837,I'll start from that it's great great
838,Illinois press and I had this kind of
839,I'm aligned around that and I'm not
840,I'm dealing with the thing in the
841,I'm in no way thought two years ago
842,I'm just I'm not going to mess with it
843,I'm not interested I'd rather write
844,I'm not interested in in paper anymore
845,I'm not really interested in reading
846,I'm not there I'm not going there I
847,I'm serious about this debt enhancement
848,image occurs to me or a phrase where I
849,imagination of language can convert what
850,immediately make a tenure-track position
851,impatient with the sort of the the
852,important a wonderful poet on a couple
853,important I don't know that that's
854,important to me in terms of of the craft
855,important whereas in in the notebook you
856,in 1979 was my MFA thesis basically and
857,in a couple of poems that correspond
858,in a line I want to make that sound
859,in all your all your poems are in one
860,in an envelope and a delivery date and I
861,in Boise and as always well I I don't
862,in in reading and sharing what I'm
863,in journals yeah quite a few more
864,in London for a couple of days which was
865,in love with living in this part of the
866,in mozi so I feel pretty sanguine about
867,in my little studio building which is
868,in Reverse maybe you know in Montana and
869,in Scotland who asked me if I could talk
870,in some way just that much more
871,in somewhere in those many boxes in the
872,in the first sort of stages of the
873,in the published book in the last poem
874,in the published book used to the first
875,in the UK I made some changes not big
876,in there probably an inch and a half
877,in this corner it's a black funnel
878,in this space so so here's this sort of
879,in your writing process you see over the
880,inches tall he was not that tall
881,incredibly wonderful but you can only go
882,incrementally and syllables not that the
883,indication or I'm going to be kind with
884,individual poems here I have batches of
885,individual poems work how this
886,information retrieval system it just
887,inland or I had another check very
888,inside Bennett at U of I
889,inspire but they seem that way to me now
890,instead of quatrains and that was so
891,intensely meditative poem that I wrote I
892,interest me something eventually is
893,interested in in that particular thing
894,interested in poems that can be sent to
895,interested in pulling things out okay
896,interested in that image to the poem
897,interesting because it was put on the
898,interesting conversation so she's doing
899,interesting to to know if this
900,internet play roles you like is that
901,intimate and that and I suppose or it
902,into it I mean that basically also I'll
903,into manipulating syntax to keep the
904,into one and I'll feel sort of
905,into storage in the in the basement
906,into the class and I got absolutely
907,into the notebooks which I do with some
908,into three portions one being kind of
909,invariably correct oh yeah you're right
910,is a so compute shortest imputed it had
911,is asana the as it stands now which
912,is definitely some of the questions um
913,is is suited to poetry and not so much
914,is kind of coming some other reading but
915,is more specifically about computers and
916,is something much more than that
917,is sort of an interesting thing to have
918,is supposed to have some sort of little
919,is the computer I have one laptop that's
920,is then I've been considering it right
921,is there an intention behind the
922,is very friendly to me and they're
923,is virtue because it is and and I'm and
924,is what I'm saying I couldn't just leave
925,isn't as a tool so I don't tend to to do
926,issue with oh wow you had a Lincoln
927,it allows you to dispense words
928,it and find it just the way you left it
929,it and then and Rodney Jones that
930,it as it can have maybe as many possible
931,it backed up all my photographs as well
932,it but it would have been a much more
933,it call Exxon and I got a hundred and
934,it can be 20 or 30 or 50 lines if it's
935,it didn't hurt to just kill the the
936,it different now that you kind of know
937,it doesn't have to rhyme anymore you
938,it has and can will continue so I don't
939,it I guess it okay the more the more
940,it in and it was on automatic backup and
941,it is I see into some kind of a phrase
942,it may be that eventually I'll get to a
943,it might be an illusion but I don't
944,it more organic when you just kind of
945,it no no I know what you mean although I
946,it off and then set it off into the
947,it on the screen go back to longhand and
948,it one two three four five six seven
949,it the marketplace the literary world he
950,it was fine that was great but then the
951,it was I've still got the other I've
952,it was read Keys North American sequence
953,it was very cool I have been really
954,it was with the typewriter even before
955,it were ah I didn't realize it but I
956,it whatever is I mean it sort I guess
957,it when you have those deadlines is it
958,it you know and then back in the back
959,it'll be great they'll be in figuring
960,it'll be this big so I can't I don't
961,it's a pretty good deal but it you know
962,it's a structural unit but then I
963,it's a vastly more elusive book too than
964,it's all that's the way I look at it so
965,it's been great having her I thought she
966,it's called earthquake light let's see
967,its evocative to me now you know I'm
968,it's from that point on I have not had
969,it's in beautiful country shit what does
970,it's it's a pretty it's a pretty good
971,it's it's hard yeah and I write a lot
972,it's it's sort of a big shift because
973,it's just a whole lot of files some of
974,it's just something about the color will
975,it's more you know the interaction of
976,it's not easy and it's a failed epic god
977,it's not if it's when yeah and it hasn't
978,it's pronounced all bro
979,it's so easy to drag-and-drop to cut and
980,it's such an easy distraction on the
981,it's surprising because in some ways
982,it's the same number of lines I can
983,it's which is not not possible but I did
984,I've added two more lines we need you to
985,I've been doing all I have to say okay
986,I've been recording like me I did I did
987,I've enjoyed many halls but let that one
988,I've got a file on one of my two email
989,I've got I probably have a hundred
990,I've got I think in sort of most
991,I've got I've got a few people who are
992,I've just been lucky enough that it
993,I've known Billy for a long time too but
994,I've never had to order these online now
995,I've not done six books yeah and my one
996,I've operated it's gotten complicated
997,Jack and most recently I sent a batch to
998,job came along I I snapped it up hey
999,John Haynes and probably most famously
1000,July or August or September or October
1001,just a sort of glorified typewriter with
1002,just I keep doing what I do and if
1003,just kidding I know twice just stop
1004,just like if I should want to which I
1005,just listen to him say this gorgeous
1006,just start putting words on paper it'll
1007,just started writing them down yeah and
1008,just that was terrific then went to lobs
1009,just to keep the old hard drive from
1010,just to see this 12 pound marble book
1011,just yeah ignited electronically no
1012,keep reading theoretically at least I've
1013,keeping them in the file I don't know
1014,keeping track of things yeah I mean
1015,kick in the pants but she's also big on
1016,Kim's not on sabbatical she worked out
1017,kind of add some sort of more pointed
1018,kind of best practices for digital
1019,kind of has like a focusing
1020,kind of keep track of all this stuff and
1021,kind of like a typewriter except that
1022,kind of mess of that and like I mean you
1023,kind of order they go most recent to
1024,kind of permanence which is dangerous I
1025,kind of quickly and then we'll get to
1026,kind of step that gets left out that was
1027,kind of structure that in fact was that
1028,kind of the way I warmed up okay when I
1029,knew back years ago I didn't have a
1030,Knicks 9 when I started converting it to
1031,Knopf Scott a huge list does one
1032,know draft number 22 and eventually once
1033,know get some feedback on and and I said
1034,know how when you save something in say
1035,know I don't I probably write ten
1036,know I starts with a date and every page
1037,know once you're at that point that you
1038,know that this was interesting how come
1039,know the way a musician would noodle
1040,know what's up with that
1041,know which is which I have to keep okay
1042,know you need you just need to have a
1043,know you're right it doesn't change much
1044,know you've got published collections
1045,know-how or or the resourcefulness to
1046,knows and you if you're if you're
1047,language somehow the lens of the writing
1048,larger fabric and that has been assisted
1049,last few times I have sent poems off to
1050,last poem that big poems that went into
1051,last that makes you pretty normal but
1052,LCSC in 1977 I was a sabbatical
1053,learned from Sarah Madeleine DeFries
1054,less boring quite honestly and it may
1055,less intimate right great I don't have a
1056,let er rip so okay so I've got sort of a
1057,let her some Gwendolyn Brooks I did
1058,let's do a class emails and just with
1059,letter from Philippine he wrote me
1060,letter it's not like getting an email
1061,letter writing to well it made little
1062,letters
1063,letters twelve letters a year now and
1064,lie down because they just did not know
1065,life you manage your career and
1066,like 12 13 hours on campus Tuesday and
1067,like a craft lecture or something
1068,like a perfectly appropriate and maybe
1069,like a real poem in that phrase and so
1070,like and they tend to be people who've
1071,like anything else I've ever written so
1072,like anything I gave
1073,like how did you kind of learn how to
1074,like how does these person you know make
1075,like most of the job ah you know if you
1076,like multimedia yeah electronics no it
1077,like so chronologically it seemed better
1078,like that and if I were to do something
1079,like that if someone comes along and
1080,like the night leaks mugger like right
1081,like to tell them my own experience
1082,like well we were there for four days
1083,like you know like the cotton and this
1084,line and do a search and find it
1085,lineage of poets who sometimes can't
1086,lineage or of that sort you know like
1087,lines on the computer screen and saying
1088,lines the way they are and I'm a
1089,linkages yeah a lot of people do I think
1090,Linus send me what you got I sent him
1091,literature I think it was but anyway
1092,little arrows and checks and numbers and
1093,little bit about correspondence in a
1094,little bit about I mean these it is like
1095,little bit about teaching but so do you
1096,little bit more and crossing out and
1097,little draft of a poem called goodbye to
1098,little ended its intended your favorite
1099,little fellows in a moleskin a or
1100,little notebook interest to me so I just
1101,little pat no gorilla steakhouse Hill
1102,loaded rhyme at the end and I like and
1103,location how do you say like how do you
1104,locations throughout the text and
1105,long days I teach Tuesdays and Thursdays
1106,longhand and part-time writing on the
1107,longhand or printing actually I print
1108,look and think I look how cool is this
1109,look at 118 and and and I'll have
1110,look at it when it was divided into
1111,looking for is to get at that particular
1112,lose anything but it keeping track of
1113,lose hundreds of pages right right yeah
1114,lose track of I mean most of these are
1115,lot of not maybe through the rest of
1116,lot of things there's a pile of drafts
1117,lot of times is what's what in which
1118,love but yet I've never I've never
1119,love Moscow and I love Idaho and I've
1120,loved it so much that I'm buying these
1121,loved most
1122,lower your standards you quit trying to
1123,luxury to be on sabbatical or as I
1124,luxury to have time it's an even greater
1125,machine changer for opinion on that
1126,machines do just because the university
1127,made me happy never not like writing a
1128,magazines and got a poem published in
1129,magazines are accepting submissions
1130,mail or you get letters from from people
1131,make a book out of but mostly I'm just
1132,make me feel like I wasn't you Eve yeah
1133,make those kinds of changes and and I
1134,make to just to make it easier to find
1135,make use of I know exactly when I first
1136,making any changes of the collection
1137,manuscript calm this of such-and-such a
1138,many different ways you don't really
1139,many of them don't suck I think there's
1140,mater and the department of the skinny
1141,maybe don't really simple but I the
1142,maybe talk a little bit about how that
1143,me this inclination toward a particular
1144,mean about my drive my poor copy editor
1145,mean but you I mean you can see I don't
1146,mean I am but I should get if she
1147,mean I can go back and look at like I
1148,mean I I'm I'm a product of the creative
1149,mean I still do this the old-fashioned
1150,mean I think I think and and no one
1151,mean I was on I was on a Guggenheim when
1152,mean instead of about yeah III think
1153,mean it still got your sort you know
1154,mean I've always got I've got a couple
1155,mean that's facetious of course but I
1156,meaning electronic devices either or
1157,mechanism yeah so I I'm not too worried
1158,meditations beautiful country and now
1159,meetings on Wednesday if they don't want
1160,Memorial and I've never had a response
1161,meter and as far as I could tell most
1162,method were seriously digital analog not
1163,metrons different about it and if you
1164,Microsoft Word
1165,mid 90s mid 90s and that you started
1166,Middle East I mean the course they're
1167,middle of the book is this other long
1168,might have been because there's just so
1169,miles north of Moscow Idaho and how long
1170,mind if you're repeating yourself as
1171,mine we talked a little bit latest set
1172,minimally minimally minor you give
1173,miss or profession will be coming I mean
1174,missed this sometimes and I go back and
1175,moment that that problem of like
1176,Montana and then I went to I went back
1177,months old so you know it's going to be
1178,moon in a mason jar that's spinning
1179,moose and bigger and you're not quite
1180,more about your writing process in
1181,more all of a piece somehow and that
1182,more because you do me the favor of
1183,more comfortable than with with just
1184,more friendly it would just be a lot
1185,more friendly or intimate kind of
1186,more overarching on your practice over
1187,more permanent now given that I live in
1188,more unusual circumstances what drives
1189,more when you're writing longhand but
1190,more with computers I really did not
1191,mornings and I mean is there like set
1192,most recent couple of these to just
1193,most to be oldest um on the bottom of
1194,mostly I was if as a model for that poem
1195,mostly it's always seemed to me that the
1196,mostly sort of hybridized I like I like
1197,mother who always embroidered
1198,move in from revision you're always
1199,moving from in sort of one fell swoop
1200,moving some product me um your
1201,much been my routine really for a long
1202,much luck making actual poems until all
1203,much of it so maybe being sort of in
1204,my father believed and beautiful country
1205,my my private computer which sometimes I
1206,my students accuse me of hitting pros
1207,my that first note so that when I come
1208,my you can always tell there's no return
1209,myself and I can do that on the computer
1210,myself standing next to the statue of
1211,name your date of birth in the location
1212,need it's like with the sonnet I don't
1213,need to go by what an external drive for
1214,need to go somewhere else I need to
1215,need to write in in these things with
1216,needs to be mean and and sometimes you
1217,negative side you know you're here
1218,never had to go retrieve anything but
1219,never have any issues with it whereas PC
1220,never really written before or who are
1221,Newark C and katha pollitt they were the
1222,Newcastle and Hull I've got a picture of
1223,next
1224,next being sort of revisional with how
1225,nitty-gritty of it well it might be
1226,no I tell the students the graduate
1227,no I well no and you know my colleague
1228,no particular order in this I mean these
1229,no way to be outside at night unless
1230,nobody else Putnam publishes Linda
1231,nonfiction writer talks about all great
1232,nonsense is often called it or I'd read
1233,noonish 12:30 between 12:30 and 1:00
1234,North program summer it takes more three
1235,not a lot of there's not a lot of love
1236,not a success home like I said I've only
1237,not all that resourceful with the
1238,not have been boring it is not still
1239,not have to go from the typewritten
1240,not stay connected very awesome because
1241,not sure which of those drafts I prefer
1242,not to fiction I did I have in fact
1243,notebook but it would look different it
1244,notebook itself you can you can or I can
1245,notebook which could you describe what
