start,end,line
1:04:00.289,1:04:05.72,so you were you were pretty familiar

1:04:02.789,1:04:07.33,with computers from from pretty much

1:04:05.729,1:04:09.65,your most invisible professional career

1:04:07.339,1:04:12.20,as they became more prevalent in the

1:04:09.659,1:04:13.76,society at large did that effect I mean

1:04:12.209,1:04:15.17,I guess it affected probably your

1:04:13.769,1:04:17.93,correspondence with your editors and

1:04:15.179,1:04:19.76,whatnot in your saclink like that did

1:04:17.939,1:04:21.59,that affect anything in the way that you

1:04:19.769,1:04:27.28,write to do start to feel different it

1:04:21.599,1:04:28.52,writing feel different um it felt more

1:04:27.289,1:04:34.46,constant

1:04:28.529,1:04:37.40,I guess I'm my students at Vermont

1:04:34.469,1:04:42.17,College they want to send me their work

1:04:37.409,1:04:45.32,everything online now and I feel like I

1:04:42.179,1:04:48.98,cannot I cannot get away from sitting

1:04:45.329,1:04:54.23,here you know 10 hours 12 hours a day

1:04:48.989,1:04:58.76,and that's that part I I don't like as

1:04:54.239,1:05:01.25,much I I still I like reading you

1:04:58.769,1:05:02.88,knowing that in a comfy chair and I feel

1:05:01.259,1:05:05.30,like we're moving away from that now

1:05:02.880,1:05:07.52,because that's becoming less and I'm you

1:05:05.309,1:05:11.75,know I'm writing ebooks myself now so

1:05:07.529,1:05:13.58,yeah so I'm a culprit to free but I can

1:05:11.759,1:05:16.36,leave my iPad in a comfy chair

1:05:13.589,1:05:16.36,yes

1:05:18.220,1:05:24.07,I still like reading in bed but once I

1:05:21.850,1:05:37.42,discovered that I can read my iPad in

1:05:24.070,1:05:41.22,bed I was happy I am sort of interested

1:05:37.420,1:05:43.87,- I guess did sort of typographical or

1:05:41.220,1:05:45.34,more graphical things I mean you see

1:05:43.870,1:05:47.80,working familiar with PageMaker did that

1:05:45.340,1:05:49.87,did any of that like ability of the

1:05:47.800,1:05:51.70,computer to adjust or I mean like I like

1:05:49.870,1:05:53.95,I think in quake with those the breaks

1:05:51.700,1:05:55.57,that were kind of like speaks a lot my

1:05:53.950,1:05:58.29,kind of jagged lines I don't know where

1:05:55.570,1:06:01.84,those came from Aceves computer thing or

1:05:58.290,1:06:03.19,you don't talk about section breaks like

1:06:01.840,1:06:04.60,the breaks within the stories that would

1:06:03.190,1:06:08.11,be like yeah like section breaks they

1:06:04.600,1:06:10.09,had like kind of I think that might've

1:06:08.110,1:06:13.12,been the science book design or those

1:06:10.090,1:06:14.74,design okay but did any of that

1:06:13.120,1:06:16.66,influence your writing I mean did you

1:06:14.740,1:06:19.09,start to and then you obviously what

1:06:16.660,1:06:21.73,response and design aspects and layout

1:06:19.090,1:06:23.62,did that influence anything with your

1:06:21.730,1:06:25.48,poems I mean I know they also you know a

1:06:23.620,1:06:26.89,lot of them will have least the earlier

1:06:25.480,1:06:30.07,one some of them would move kind of tab

1:06:26.890,1:06:32.05,by tab and then I mean there's other

1:06:30.070,1:06:35.47,different sort of strategies in palms

1:06:32.050,1:06:37.75,too but there I don't know I mean I'm

1:06:35.470,1:06:44.86,trying to think about what you're asking

1:06:37.750,1:06:46.96,me because I just want remembering um or

1:06:44.860,1:06:49.60,if there's any particular way that that

1:06:46.960,1:06:51.52,changed in my writing itself yeah I mean

1:06:49.600,1:06:54.43,I don't think it wasn't I don't know

1:06:51.520,1:06:55.60,that I can say that it I guess when

1:06:54.430,1:06:56.47,you're writing in your note baby that's

1:06:55.600,1:06:58.93,the way to get when you're writing in

1:06:56.470,1:07:00.52,your notebook are you writing with sort

1:06:58.930,1:07:02.20,of indentation and other things like

1:07:00.520,1:07:07.75,that or are you pretty much down the

1:07:02.200,1:07:09.10,left margin to those who does that sort

1:07:07.750,1:07:10.51,of layout saying transfer to the

1:07:09.100,1:07:13.87,computer right you're right you know I

1:07:10.510,1:07:16.78,what little experimenting I've done

1:07:13.870,1:07:20.47,along those lines with poems I've done

1:07:16.780,1:07:23.98,on the computer screen sugar yeah I mean

1:07:20.470,1:07:26.26,that's I think my I know we're going to

1:07:23.980,1:07:29.20,talk about this later what I'm doing now

1:07:26.260,1:07:30.94,I'm doing these altered book pages right

1:07:29.200,1:07:32.70,you know if I showed you any of those

1:07:30.940,1:07:37.12,crystals are all blah

1:07:32.700,1:07:41.22,files but I'm doing these altered book

1:07:37.120,1:07:44.26,pages and those are that's where all

1:07:41.220,1:07:47.23,everything I know about Photoshop and my

1:07:44.260,1:07:51.55,poetry is like finally coming together

1:07:47.230,1:07:55.42,into something that feels more I don't

1:07:51.550,1:07:56.89,know my own yeah different so we can

1:07:55.420,1:07:58.80,talk about that everybody

1:07:56.890,1:08:04.75,so is that different than the photons

1:07:58.800,1:08:06.37,yeah okay yeah um what sort of for

1:08:04.750,1:08:12.82,tonight I'll show you

1:08:06.370,1:08:14.68,so I'm um I put these online I send this

1:08:12.820,1:08:19.03,is mainly what I've been publishing

1:08:14.680,1:08:24.49,lately I found this old encyclopedia up

1:08:19.030,1:08:28.21,here from the 30s and I've been scanning

1:08:24.490,1:08:32.11,the pages okay especially pages that

1:08:28.210,1:08:43.90,have a lot of graphic material in them

1:08:32.110,1:08:48.73,and yeah so I I put them on this website

1:08:43.900,1:08:52.24,but in a in a locked gallery cuz this is

1:08:48.730,1:08:55.93,how I share them then with editors oh ok

1:08:52.240,1:09:02.11,so let's see y'all try to find that it's

1:08:55.930,1:09:04.42,like Latino one here so Zenfolio is like

1:09:02.110,1:09:07.60,this like a webservice kind of yeah this

1:09:04.420,1:09:10.84,isn't really for photographers website

1:09:07.600,1:09:13.24,but I just liked it because it has a

1:09:10.840,1:09:16.03,really clean look yeah and their

1:09:13.240,1:09:17.74,slideshow mode is really nice yeah so

1:09:16.030,1:09:22.98,this is the book I'm doing with my

1:09:17.740,1:09:27.19,husband right now and these are his

1:09:22.980,1:09:32.47,these are his illustrations so I can

1:09:27.190,1:09:36.04,actually put this in slideshow you can

1:09:32.470,1:09:39.70,see that so this is my fiction project

1:09:36.040,1:09:42.49,okay that I'm busy the novella this is

1:09:39.700,1:09:44.29,yeah this I will only I haven't shared

1:09:42.490,1:09:46.00,this actually with any editors yet

1:09:44.290,1:09:53.88,because I'm only just putting this

1:09:46.000,1:09:58.33,online that's a section be lighter page

1:09:53.880,1:10:01.60,this is called a pull for stop so then

1:09:58.330,1:10:03.55,and then this story goes like this so

1:10:01.600,1:10:06.07,these are Rick's pieces and then I have

1:10:03.550,1:10:10.03,this little story that goes with these

1:10:06.070,1:10:12.28,characters in the book here and each

1:10:10.030,1:10:15.91,page I think of it as a little like

1:10:12.280,1:10:18.46,flash fiction yeah yeah so I kind of

1:10:15.910,1:10:20.53,think of them as linked flash fiction

1:10:18.460,1:10:23.65,and they're relating in some way to the

1:10:20.530,1:10:29.32,image oh yeah okay so that's that book

1:10:23.650,1:10:33.87,that book and I was telling you multi

1:10:29.320,1:10:33.87,encyclopedia and that's book of no ledge

1:10:34.920,1:10:42.97,and so this is how I send them out now

1:10:39.250,1:10:46.63,to editors hmm I'll probably send like

1:10:42.970,1:10:49.00,two or three of these pieces in you know

1:10:46.630,1:10:51.73,the online submission or whatever and

1:10:49.000,1:10:55.24,then I send them a link to this to this

1:10:51.730,1:10:57.25,gallery and the password that they need

1:10:55.240,1:11:01.36,to access it because the locked gallery

1:10:57.250,1:11:03.52,that way I can kind of track on you know

1:11:01.360,1:11:06.01,how many people are looking editors are

1:11:03.520,1:11:08.77,looking at myself at the same time right

1:11:06.010,1:11:11.56,and then when somebody takes a piece I

1:11:08.770,1:11:14.38,put these little asterisks this just

1:11:11.560,1:11:16.45,like screwed up things so they kind of

1:11:14.380,1:11:19.27,can realize all those are out of

1:11:16.450,1:11:26.40,commission then so that's what so now

1:11:19.270,1:11:29.29,I'm kind of actually putting a poem and

1:11:26.400,1:11:32.17,I hate all this fail stuff in here but

1:11:29.290,1:11:34.69,there's since then I'm actually kind of

1:11:32.170,1:11:39.01,replacing the text that was here in the

1:11:34.690,1:11:40.96,encyclopedia with a poem and and so

1:11:39.010,1:11:42.97,you'll do that in Photoshop like you'll

1:11:40.960,1:11:44.47,erase the text and then you'll are you

1:11:42.970,1:11:47.37,trying to match the font in some way it

1:11:44.470,1:11:50.02,looks like or at least kind of it I am

1:11:47.370,1:11:52.99,and then those are images from the text

1:11:50.020,1:11:56.26,originally yes actually they're from

1:11:52.990,1:12:00.10,like three different pages in the text

1:11:56.260,1:12:02.70,and then I've colorized them to Carlini

1:12:00.100,1:12:05.26,project it's really been fun I like I

1:12:02.700,1:12:07.23,like doing that you can see I've kind of

1:12:05.260,1:12:11.92,done a little bit of a racer stuff in

1:12:07.239,1:12:15.22,here yeah and then this part is my poem

1:12:11.920,1:12:18.69,over here so I like as I said put these

1:12:15.220,1:12:27.88,in slideshow cos they're come out water

1:12:18.690,1:12:32.02,but I kind of like having a mix of what

1:12:27.880,1:12:35.92,would be encyclopedia language with naps

1:12:32.020,1:12:40.66,talk kind of I like going back and forth

1:12:35.920,1:12:43.36,so that's this has been where I've

1:12:40.660,1:12:47.32,really started to use the technology

1:12:43.360,1:12:51.21,much more than I was before so I have

1:12:47.320,1:12:54.37,all those people this is the straight

1:12:51.210,1:12:57.34,cyclopdia man stuff and I hope they

1:12:54.370,1:13:04.78,kind of talk back and forth to each

1:12:57.340,1:13:07.45,other the language yeah no I see what

1:13:04.780,1:13:10.51,you're saying my language here in their

1:13:07.450,1:13:12.01,language and well I'm sorry it's sort of

1:13:10.510,1:13:15.19,like contextualizes and sort of

1:13:12.010,1:13:17.26,decontextualize isn't it yeah yes my

1:13:15.190,1:13:21.40,little conversation with proof I've been

1:13:17.260,1:13:27.70,reading proof to shared I see improves

1:13:21.400,1:13:29.86,there on a timeout right now anyway

1:13:27.700,1:13:31.78,that's Alaska thing looks like I like

1:13:29.860,1:13:33.88,the pate I like the pages from the

1:13:31.780,1:13:38.08,encyclopedia that have all this graphic

1:13:33.880,1:13:41.92,material so I can um I kind of take what

1:13:38.080,1:13:45.07,was you know I what I have I put all

1:13:41.920,1:13:49.18,these kind of romance words around in

1:13:45.070,1:13:51.40,this one timber Wolf's love nipped not

1:13:49.180,1:13:53.95,skok soulmate I gave them kind of

1:13:51.400,1:13:56.05,anything yeah different a merciless

1:13:53.950,1:13:58.06,but a person would have to sort of go in

1:13:56.050,1:14:01.33,there and look a little bit right that's

1:13:58.060,1:14:05.83,ready to see yeah I mean yeah I mean it

1:14:01.330,1:14:08.02,is to pay attention salt that's that's

1:14:05.830,1:14:09.72,where things have sort of evolved

1:14:08.020,1:14:13.20,computerized from

1:14:09.729,1:14:15.09,and how does that I mean what's the like

1:14:13.209,1:14:16.74,does it feel different is it disorder

1:14:15.099,1:14:18.96,that seem like the same creative process

1:14:16.749,1:14:21.94,for you I mean I mean it's visual and

1:14:18.969,1:14:24.30,textual so there's that but in terms of

1:14:21.940,1:14:29.13,using the computer to make is that a

1:14:24.309,1:14:31.95,change well so the way I've been I have

1:14:29.139,1:14:33.69,some really interesting different ways

1:14:31.959,1:14:37.20,that I've been doing these that have

1:14:33.699,1:14:40.38,never been even remotely like working on

1:14:37.209,1:14:44.97,the palms of stories so I'll print out

1:14:40.380,1:14:47.55,first the original scans and black and

1:14:44.979,1:14:49.20,white and that's what I carry around in

1:14:47.559,1:14:52.03,my little notebook you know I'm so

1:14:49.209,1:14:53.65,fixated to the notebook there so I'm

1:14:52.030,1:14:55.42,carrying those around the notebook and

1:14:53.650,1:14:58.42,then I just actually just start

1:14:55.420,1:15:03.42,scribbling on the pages scribbling stuff

1:14:58.420,1:15:05.73,out I'm one of the things that I'm kind

1:15:03.429,1:15:09.78,of doing with this book project with the

1:15:05.739,1:15:13.92,encyclopedia is this is my version of a

1:15:09.789,1:15:18.21,Collected Poems of Nance Van Winkle so

1:15:13.929,1:15:21.82,I'm kind of mining some of my early

1:15:18.219,1:15:23.67,poems because I the idea of doing a

1:15:21.820,1:15:26.44,collected or selected or something is

1:15:23.679,1:15:29.32,kind of boring to me actually okay but

1:15:26.440,1:15:31.69,this made it more interesting to do yes

1:15:29.320,1:15:34.92,because I'll just pull out oh I always

1:15:31.690,1:15:38.13,like this Danson yeah I like to stand

1:15:34.929,1:15:41.40,and then I you forget the rest of that

1:15:38.139,1:15:44.40,foam you know but these five lines I

1:15:41.409,1:15:47.53,like so I'll sprinkle them in there and

1:15:44.409,1:15:51.15,it's been fun to kind of find the visual

1:15:47.530,1:15:54.15,material that I think they fit with yeah

1:15:51.159,1:15:56.22,so anyway I'm so wealth of human

1:15:54.159,1:16:00.24,knowledge from thirty thirty well

1:15:56.229,1:16:04.36,exactly exactly and you know I feel like

1:16:00.249,1:16:05.73,I'm kind of talking I am I said one of

1:16:04.360,1:16:08.49,the things that's going on in this

1:16:05.739,1:16:15.32,project is I'm talking back to history

1:16:08.499,1:16:19.57,in a way and say no that's not right and

1:16:15.329,1:16:21.18,I like that I like that Marisa and I

1:16:19.570,1:16:24.09,guess in some ways the software allows

1:16:21.189,1:16:26.55,you more

1:16:24.099,1:16:28.63,purchase on making them deletion and

1:16:26.559,1:16:33.46,adjustment exactly and it would have

1:16:28.630,1:16:34.44,really crossing out or like board right

1:16:33.460,1:16:35.98,yeah

1:16:34.449,1:16:38.40,and the erase you're saying you know

1:16:35.980,1:16:40.21,that a lot of people are doing yeah that

1:16:38.409,1:16:43.05,seems like you know I'm good friends

1:16:40.210,1:16:46.23,with Mary rueful through an amazing

1:16:43.059,1:16:48.67,resource every yeah I feel like I could

1:16:46.239,1:16:51.61,run up Mary rueful I'm not doing that

1:16:48.670,1:16:53.76,I'm not going there there are people who

1:16:51.610,1:16:56.59,are doing that so much better

1:16:53.760,1:16:59.44,I've always been a fan of it that Robbie

1:16:56.590,1:17:01.63,off to paradise block leashes around uh

1:16:59.440,1:17:07.21,uh how did this team like you're gonna

1:17:01.630,1:17:11.50,yeah and I weigh who did one like oh he

1:17:07.210,1:17:13.75,didn't really happy birth mirrors yeah a

1:17:11.500,1:17:14.96,lot I think maybe too many people jumped

1:17:13.750,1:17:17.67,on the eraser its

1:17:14.969,1:17:19.23,bandwagon it's but it's hot I mean it's

1:17:17.679,1:17:21.57,really I mean to do it in the latest

1:17:19.239,1:17:23.53,miracle so it is really really hard I

1:17:21.579,1:17:27.34,mean like yeah here's something area was

1:17:23.530,1:17:30.03,all set the way I do it is I look at the

1:17:27.340,1:17:32.34,page and then pretty soon if I just

1:17:30.039,1:17:44.71,stare at it for a while a few words

1:17:32.349,1:17:53.61,slowed up good okay oh oh

1:17:44.710,1:17:57.48,eliwood so words flowed up into a lot of

1:17:53.619,1:17:57.48,these questions in the course of it

1:18:08.270,1:18:12.61,Oh can you find your files like if

1:18:11.000,1:18:16.91,you're looking for like a certain phone

1:18:12.610,1:18:18.74,on your computer would you if you have

1:18:16.910,1:18:20.42,difficulty locating them or are you is

1:18:18.740,1:18:27.23,your organization such that you pretty

1:18:20.420,1:18:30.41,much know where things are I have lost I

1:18:27.230,1:18:34.04,have lost things and yeah almost every

1:18:30.410,1:18:36.58,week I have a little battle because I

1:18:34.040,1:18:40.88,can't remember why I called something

1:18:36.580,1:18:42.86,yeah yeah do you worry at all about the

1:18:40.880,1:18:48.11,security or some fixity of these digital

1:18:42.860,1:18:50.87,files no no you mean somebody else

1:18:48.110,1:18:54.56,accessing them or something that Jeremy

1:18:50.870,1:18:56.36,or the kind of fidelity of them I guess

1:18:54.560,1:18:58.07,I mean visitors I mean you do say that

1:18:56.360,1:18:59.78,you have floppy disks and old Word

1:18:58.070,1:19:01.82,Perfect documents or something that you

1:18:59.780,1:19:03.11,can't access that is that a concern to

1:19:01.820,1:19:04.60,you or you just think that will kind of

1:19:03.110,1:19:08.78,take care of itself

1:19:04.600,1:19:11.00,um it's not a concern to me maybe it

1:19:08.780,1:19:13.40,should be no I don't I actually don't

1:19:11.000,1:19:16.64,think it should be but um and I'm I'm

1:19:13.400,1:19:17.75,wanting to know that so okay but I mean

1:19:16.640,1:19:19.31,that yeah there's definitely things we

1:19:17.750,1:19:21.32,can do but I mean it's one of those

1:19:19.310,1:19:23.63,things that I think well I guess the

1:19:21.320,1:19:25.13,other question is have the changes in

1:19:23.630,1:19:29.36,computers I mean like you know probably

1:19:25.130,1:19:31.97,in the 98 90s early 90s computers

1:19:29.360,1:19:34.10,crashed much more often more likely to

1:19:31.970,1:19:37.48,lose work too bad ever influence the way

1:19:34.100,1:19:39.92,that you work on computers or was that

1:19:37.480,1:19:43.64,were you pretty much kept the same

1:19:39.920,1:19:46.04,strategies I have pretty much kept the

1:19:43.640,1:19:49.58,same strategy she no I've never had a

1:19:46.040,1:19:52.07,really bad thing happen where I've lost

1:19:49.580,1:20:01.01,the hard drive or anything like that I

1:19:52.070,1:20:04.19,know I know and you know they got you

1:20:01.010,1:20:09.11,bigger they really do I I just I love

1:20:04.190,1:20:10.91,all their products as I could so a few

1:20:09.110,1:20:12.62,questions are correspondences teaching

1:20:10.910,1:20:15.27,all the way to sever sabbatical couple

1:20:12.620,1:20:19.11,episode m and another view

1:20:15.270,1:20:21.04,so you have you ever correspondent very

1:20:19.119,1:20:23.23,much in like like physical letters has

1:20:21.040,1:20:24.63,that ever been a person or but I mean

1:20:23.230,1:20:26.08,play to your writing I don't need to

1:20:24.639,1:20:27.55,know you know the personal

1:20:26.080,1:20:30.69,correspondence not so much but I mean

1:20:27.550,1:20:35.34,like writing wise to realize that ever

1:20:30.690,1:20:37.06,no physical letters I well like I was

1:20:35.349,1:20:39.19,telling you with that first book of

1:20:37.060,1:20:44.59,poems I've kept all the letters that he

1:20:39.190,1:20:47.76,wrote to me about revision yeah I don't

1:20:44.590,1:20:50.13,know they just they're very dear to me

1:20:47.760,1:20:54.15,that somebody took that kind of time

1:20:50.139,1:20:56.50,with me and and then I have a good

1:20:54.159,1:20:59.29,friend who's a poet I think I mentioned

1:20:56.500,1:21:01.59,her to you Jennifer Boyd muse and she

1:20:59.290,1:21:03.52,really loves the physical letter and

1:21:01.599,1:21:05.53,I've kept all her letters that she's

1:21:03.520,1:21:08.38,written me over the years because

1:21:05.530,1:21:15.40,they're just beautiful and and it just

1:21:08.380,1:21:18.28,always seems like just the idea that

1:21:15.400,1:21:20.63,somebody is writing this just to me you

1:21:18.280,1:21:23.61,know the three page letter with her

1:21:20.639,1:21:25.50,thoughts and ruminations about things

1:21:23.619,1:21:28.71,and they're just so beautifully written

1:21:25.500,1:21:32.61,but she would take the time to do that

1:21:28.719,1:21:36.04,you know it's it seems like a treasure

1:21:32.619,1:21:38.40,thing because it's passing but do I do

1:21:36.040,1:21:38.40,it

1:21:39.610,1:21:45.88,do you have any similar feelings for

1:21:42.520,1:21:52.33,anything yes you have email but you to

1:21:45.880,1:21:56.23,feel fear about oh I do keep some emails

1:21:52.330,1:22:00.01,I have you know files these emails that

1:21:56.230,1:22:01.27,I keep from certain people a minute and

1:22:00.010,1:22:04.69,it's a corollary to that do you feel

1:22:01.270,1:22:06.48,like a this is an odd question but do

1:22:04.690,1:22:09.84,you have any sort of feelings towards

1:22:06.489,1:22:12.04,your digital files about yet your poem

1:22:09.849,1:22:13.33,you feel like are they dear to you in

1:22:12.040,1:22:18.01,the same way maybe a notebook would be

1:22:13.330,1:22:20.46,here you or no no the notebook is dearer

1:22:18.010,1:22:24.69,okay I don't know I don't know what

1:22:20.469,1:22:26.46,that's weird touch it is could it be

1:22:24.699,1:22:28.63,part of it is

1:22:26.460,1:22:30.37,yeah there's me I don't know yeah it's

1:22:28.630,1:22:31.84,one of those one of those things I don't

1:22:30.370,1:22:33.64,know if that will change

1:22:31.840,1:22:36.34,like if someone never had but this is

1:22:33.640,1:22:38.11,cool in the future it would have the

1:22:36.340,1:22:41.25,special folder on the desktop that just

1:22:38.110,1:22:47.22,to talk to me but you know I try to be

1:22:41.250,1:22:50.65,careful that I've always got a hardcopy

1:22:47.220,1:22:52.63,somewhere the material I'm working I

1:22:50.650,1:22:54.78,like this book that I'm doing with my

1:22:52.630,1:23:00.76,husband okay

1:22:54.780,1:23:05.68,and there they all are because and the

1:23:00.760,1:23:09.12,way that well to finish that that

1:23:05.680,1:23:12.82,thought about just being careful because

1:23:09.120,1:23:16.03,it's just if things go awry here I

1:23:12.820,1:23:19.18,really I don't want to lose the work

1:23:16.030,1:23:21.37,completely free so I try to make sure

1:23:19.180,1:23:23.65,that I have a hard copy it's not always

1:23:21.370,1:23:28.03,the most recent copy yeah but there's

1:23:23.650,1:23:32.95,there's the coffee right so and with

1:23:28.030,1:23:35.17,this book I did all of the arranging of

1:23:32.950,1:23:37.93,it I stuck them on that wall in the

1:23:35.170,1:23:41.32,hallway okay and all the pages were on

1:23:37.930,1:23:43.33,that wall and I was moving I had little

1:23:41.320,1:23:46.45,sticky things on the back and I was

1:23:43.330,1:23:49.30,moving them around to make the sections

1:23:46.450,1:23:50.02,of the book for it was up there for like

1:23:49.300,1:23:53.80,three months

1:23:50.020,1:23:55.27,yeah three three months off so you would

1:23:53.800,1:23:57.28,just would you come home and see them

1:23:55.270,1:23:59.23,and make a few changes or was it

1:23:57.280,1:24:03.94,basically be a dedicated time that you

1:23:59.230,1:24:05.80,go to it er um well it was I was at that

1:24:03.940,1:24:08.92,stage with the book or I had all these

1:24:05.800,1:24:11.53,pages but I wasn't exactly sure you know

1:24:08.920,1:24:14.77,how I was going to arrange the the

1:24:11.530,1:24:17.44,chronology again on the story yeah so I

1:24:14.770,1:24:22.24,started experimenting with different

1:24:17.440,1:24:24.67,orders of things by putting this China

1:24:22.240,1:24:27.52,sections on the on the boards on the

1:24:24.670,1:24:30.82,wall that way yeah moving them around so

1:24:27.520,1:24:35.83,because s so before I had each page as

1:24:30.820,1:24:37.33,its own file in there and now and now

1:24:35.830,1:24:39.43,they have sections to

1:24:37.330,1:24:42.37,section I think they're five sections in

1:24:39.430,1:24:46.00,the book and those came from the wall

1:24:42.370,1:24:48.85,yeah okay so but I had to I could not

1:24:46.000,1:24:51.40,figure out a way to look at that many

1:24:48.850,1:24:55.06,pages on the screen at one time and I

1:24:51.400,1:24:58.48,mean actually see the print okay that

1:24:55.060,1:25:01.06,was yeah I felt like I the technology

1:24:58.480,1:25:08.56,wasn't allowing me to see the big

1:25:01.060,1:25:11.52,picture the way I needed to I'm sure

1:25:08.560,1:25:15.22,they're coming after they're here yeah

1:25:11.520,1:25:22.56,exactly yeah you too big wall this is

1:25:15.220,1:25:25.92,you and if Mac makes it I'm buying it is

1:25:22.560,1:25:30.13,only going to be a million dollars yeah

1:25:25.920,1:25:32.95,I guess we did talk a little bit about

1:25:30.130,1:25:34.54,your teaching and that you do correspond

1:25:32.950,1:25:39.52,by email with your students mostly is

1:25:34.540,1:25:43.69,that um now if they insist on it okay

1:25:39.520,1:25:45.55,I'm sending me their work as attachments

1:25:43.690,1:25:47.59,and everything I'll read it that way I

1:25:45.550,1:25:49.63,don't like doing it with the poet's with

1:25:47.590,1:25:51.97,the fiction people I was much much

1:25:49.630,1:25:54.85,rather they send me their work in the

1:25:51.970,1:25:56.80,mail okay and usually they're okay with

1:25:54.850,1:25:58.69,them you kind of take it and not have to

1:25:56.800,1:26:01.87,be connected and not have to and then

1:25:58.690,1:26:05.26,yeah yeah and I just I do not like

1:26:01.870,1:26:08.76,writing my comments laundress in with

