original,line
1246,notes to myself sometimes notes and
1247,notes tools tools yeah uh I just saw a
1248,nothing and all of that stuff you know I
1249,novel about she downloaded maps of all
1250,now and then and if I do wind up
1251,now just breathe all I would comfort
1252,now of course it's just such a breeze
1253,now well of course I'm especially fond
1254,numbers and 186 maybe go into the
1255,numbers so I thought this is insane and
1256,observed have you ever received her
1257,occasion Dorian lux's has looked at
1258,occasionally this has not happened to
1259,occurred to me simply because the so
1260,of 1995 and I really honestly that this
1261,of a lot of tight spaces I know how to
1262,of a sudden I did yeah
1263,of an intermediary thing although
1264,of any sort of like their sort of
1265,of anything so I began to be a whole lot
1266,of copies made me a lot of money I
1267,of course but he's published I think two
1268,of course it does I mean when I in the
1269,of delineate a difference between how
1270,of electric typewriter but uh and I
1271,of Express no and yeah well you get some
1272,of failed poet
1273,of files in there this just called fan
1274,of gets us started but I mean the next
1275,of it because it's like the newest baby
1276,of line and yeah and I wish you will
1277,of my my father 24/7 I would have my
1278,of network of other writers any sort of
1279,of occasions Phil Levine has looked at
1280,of on to sort of how you organize you
1281,of our great indulgences but you know
1282,of poems I ever sent out I got something
1283,of poetry and I don't think my notion of
1284,of references and links to other things
1285,of some of these some of the margin me
1286,of that may just be that I've gotten to
1287,of the hole and the sections there n
1288,of the millennium I think for me and it
1289,of thing
1290,of time looking out the window but
1291,of turrets and still have the poem be
1292,of well the kind of thing that was more
1293,of what
1294,of writers that I did and it's more
1295,off a long draught and then I'd start
1296,off put them in a box and eliminate them
1297,off relentlessly
1298,off so it tapers heavy so I guess you
1299,off that there stay still love me but
1300,offered that degree in 1972 I think and
1301,office hours and hopefully if I'm on a
1302,often it was just another poet another
1303,oh I'm subtracting okay absolutely I
1304,oh no I just sat down the computer and
1305,oh sections crossed out so I guess you
1306,oh yeah Harrison okay how does it work
1307,okay and read at a place called the
1308,okay bingo and that sort of thing I
1309,okay I have a Mac what is it a MacBook
1310,okay it's a you know yeah it's a it's
1311,okay so first you would please face your
1312,okay so that's sort of a general
1313,okay so when you first started writing
1314,old and seemingly laborious manual
1315,on a book no I'm just writing poems yeah
1316,on a jump drive I think maybe too he
1317,on a kind of lark what happened if I
1318,on barriers I don't know well it on the
1319,on Moscow mountain not far well six
1320,on the computer screen let's say now in
1321,on the computer somewhere prowling
1322,on the Hasek I was reading and I heard
1323,on the U of I account because that's the
1324,on them if it takes me long until one
1325,on well that's sort of been the way I've
1326,on what you go don't want you to go as a
1327,once it's gone into bigger file oh
1328,once my papers it would be a lot happier
1329,once you how do you then you just
1330,one a low first question is when did you
1331,one device you ever moved things for one
1332,one I think that's one Kim retired
1333,one in Canada and applied to a number of
1334,one of the colonies this is the gemstone
1335,one of these no when this was 1996 I
1336,one of those fit your mode or is he
1337,one on on BBC four which is they tell me
1338,one's not pinning you you have to
1339,online yeah you find you have to
1340,only way I can get started is to just
1341,or come by they can just ask you and
1342,or five anonymous letters from some
1343,or not the large arc of your career and
1344,or or and then moving to the computer
1345,or staying the same as well I think III
1346,or three books and they've all been
1347,order to have some sense of what might
1348,organic for me about having the vision
1349,organize your stuff on the computer
1350,organizing poems in the book rain of
1351,orient revise drink no no I do when I
1352,other hand we we came and I enjoyed
1353,other kind of a reference a poem as Dick
1354,other people I think I said something
1355,other place I was really interested or
1356,other poets other writers but I don't
1357,other stanzas so I
1358,other stone okay
1359,other the example that occurs to me is
1360,other thing and it's the other thing
1361,other thing how can I make what this
1362,other thing Tony tony early the fiction
1363,other whole set of files so I am
1364,oughta had a comma there but by the way
1365,our conversation together and the email
1366,our correspondence over the last decade
1367,out early on
1368,out here by between my
1369,out here or where I go wherever it was I
1370,out longhand or you certainly feel them
1371,out of hell I got here I guess like what
1372,out or it usually holds ten reams of
1373,out that prose poem in stanzas had to be
1374,overview and then I'd like to kind of
1375,overwhelming sense of their being in arc
1376,owns the machine and I'd really don't
1377,page by the hand of the poet rather than
1378,page seven or or asked are a check 1:18
1379,paper right before these things that
1380,papers especially Western writers yeah
1381,part is where I tell my students I mean
1382,part of it too but publication you know
1383,part so there's a a poem on your
1384,particular on my mind whereas in the
1385,particular poet does his or her work and
1386,particular something and what I'm
1387,particular sound that appeals to me or
1388,particular title and that's it or
1389,particularly like or feel is evocative
1390,particularly strange because so many
1391,particularly were just enormous ly
1392,paste with a computer that it's it's
1393,Paul Muldoon and and that you know it's
1394,pay by the pound ha ha ha
1395,pen date on the corner of the draft just
1396,penciled in I thought about winding and
1397,pencils and pens and notebooks do you
1398,penguin all won prizes then it cooled
1399,Penguin Books over there because I'd
1400,penguin Random House and nobody knows
1401,people are much more resourceful with it
1402,people couldn't figure out what it meant
1403,people do you know beyond debt I have
1404,people I know a lot of poets I know of
1405,people like Pope probably are just red
1406,people tell me all the time when you
1407,people who buy so many piles of writers
1408,people you know people always ask things
1409,perceived the book this book and three
1410,perfectly comfortable just looking at
1411,person who hates me
1412,Philip Larkin in the train station oh
1413,phrase or it kind of moved toward an
1414,pick up that cell I call it sounds
1415,picture sir now if this is recording I'm
1416,pile called crank I've gotten like four
1417,place where you you surprise yourself
1418,places where when I get an idea or an
1419,Plath or and read the book of nightmares
1420,plumbers block I can't help you and and
1421,poem and such and such or then poems
1422,poem did so anyway I got I got waylaid
1423,poem go someplace else it might not have
1424,poem I lay him out on the floor but then
1425,poem in beautiful country is two hundred
1426,poem in lines on the word processor and
1427,poem is after and that what is
1428,poem to happen and it used to be as I
1429,poems and everything then it's mozi or
1430,poems and when email came along that
1431,poems for me Henry Carlyle who is only
1432,poems that have been published with the
1433,poems that have been submitted over here
1434,poems yeah and so what kind of devices
1435,poet friend I'd write him a letter
1436,poetry almost exclusively every now and
1437,Pope's and think if this had been cut by
1438,position opened up here and the only
1439,position same job and over this time
1440,possibilities of the poem might be and
1441,practices when you first started I mean
1442,prefer the process to the product
1443,preferred to have written to writing I
1444,presented it or does it or actually is
1445,pretty aware of what I'm up to and but
1446,pretty young program really yeah you
1447,prewriting read your notes I print off a
1448,prewriting those kind of development of
1449,primary mode of textual changes it's an
1450,primary motive probably around the turn
1451,print all of them all some i some I do
1452,print out and then do extensive
1453,printed off I got a whole file just of
1454,prints things I mean he's he's anal
1455,probably be a good idea to do something
1456,probably try to find them all huh no I
1457,process I can we more concerned about
1458,process there anything as you do I mean
1459,professional about it as a plumber is I
1460,professionally in which I mean something
1461,program to determine where the ends of
1462,programs wound up going to Montana fell
1463,prose poem in stanzas okay
1464,publicity who is now my editor who is
1465,publish a book of mine I can I can make
1466,published a couple of short stories
1467,published a poem in The New Yorker lot
1468,published and therefore might be
1469,published book used to be the last poem
1470,published I mean I that was all typed on
1471,published one less than a year ago right
1472,published reign of snakes the year I was
1473,publisher need for poetry lists what's
1474,publishing is your career you live your
1475,pull the get the hard drive out and
1476,pulling the one off the top this is a
1477,puny yeah but I've cut the the longest
1478,put it down yeah yeah okay so so that
1479,put it in a book it's it's it's finished
1480,put it in a different place you
1481,put stuff in boxes that's pretty well
1482,put them all together or you say oh I
1483,put things into the cloud the iCloud I
1484,put together that book manuscript and
1485,putting a poem as an attachment and send
1486,putting together a book manuscript I my
1487,quadrant more or less the same structure
1488,qualifies is failure and ambition and so
1489,quatrain the first quatrain ends with
1490,question is sort of like could you give
1491,question was that it does it seem I mean
1492,question yeah I kept I have always and I
1493,questions about computer and using
1494,questions that are sort of getting at
1495,quick and dirty questions but so what's
1496,Random House publishes Billy Collins and
1497,rather have theoretically Monday and
1498,read poems out of books at all bruh and
1499,reader and she's knows me so well that
1500,reading more like that people keep
1501,reading situations how do you feel about
1502,readings as through our readers what do
1503,realized that you know wait a minute I
1504,really been interested in writing one
1505,really beginning of work and various I
1506,really I just talked with Terence Hayes
1507,really is the kind of storage kind of
1508,really kind of do I'm delighted by the
1509,really loved the finished product or
1510,really most leads our first graph still
1511,really need any I don't need an idea I
1512,really stops once I get it in this in
1513,really trust the poem I was this not
1514,really willing correspondence and write
1515,reason or another I'm uncertain of the
1516,regard I think that it that it's just
1517,regularity just to sift through and see
1518,relationship to computers that they sort
1519,relying on them you know yeah so if I
1520,remember it and you know if I just go to
1521,repeating ourselves if you don't mind
1522,replacement for you
1523,respond and I do it's also great though
1524,retrieve everything hard drive was fine
1525,retrieve something off a forest fire
1526,revise that's a really good question
1527,revising the drill but then you're also
1528,revising you have there an intention
1529,revision general exam and so you're
1530,revision on the computer and the
1531,revision or you just sort of follow well
1532,revision process when I get seriously
1533,revisions on arrows things crossed out
1534,rhyme when I make a sound that I
1535,Richard Hugo and and they were you know
1536,ridiculous but yeah I'm loving me the
1537,right and something about saving and
1538,right and then I guess I mean we didn't
1539,right and what you were doing wrong with
1540,right in this spot and she's almost
1541,right margin mattering and and somehow
1542,right offer positive well yeah I should
1543,right right so I I I get it back out and
1544,right yeah and both stood by the time I
1545,rips through when I'm gone and it burns
1546,routine do you come out here in the
1547,sabbatical and two as I am now
1548,sabbatical yeah we'll see about that
1549,sacred ever but mostly when I'm ready to
1550,said hold homes would happen dog in
1551,said researcher should he or she ever
1552,said um you can't hate to realise you
1553,said well you know you're getting
1554,saying already done it I want to do that
1555,says what I do it from classes Jesus oh
1556,school she knows her stuff she says
1557,Scotland so much we I've been trying to
1558,Scottish poetry library which is just
1559,screen gives it the appearance more of a
1560,screen I mean there was nothing special
1561,seamlessness but not a kind of
1562,second-guess yourself you quit sitting
1563,section is based on that initial survey
1564,section of questions and I want to ask
1565,sections in each of the four parts and
1566,sections is part of the assemblage of
1567,sections so that each of I mean it seems
1568,see 99 the year I the year I was hired I
1569,see how that works so I guess the last
1570,see I got my first computer in the fall
1571,see I see five points I've been doing
1572,see or hear opportunities to to let the
1573,see some phrase I I make a note I make
1574,see the paper bald feels boldface
1575,see the possibility of substituting a
1576,see there there's some connective tissue
1577,see where the poem goes just to see
1578,seeing it on the screen in the computer
1579,seemed like a great way into the book
1580,seems far less effective to me to sit
1581,seems like I'm having good luck and part
1582,seems to me that it would it would
1583,seen that I would have seen if I'd been
1584,self-published
1585,send my now I send the editor an email
1586,send those well the Georgia review and
1587,sent out got accepted by our first batch
1588,sequence called rain of snakes yeah and
1589,sequence over the course of like two
1590,service as well
1591,serviceable in a collection somewhere
1592,seven eight and and all and then you go
1593,shade on a swindle or a value I didn't I
1594,she can just she can tell when she needs
1595,she did that nothing but and she never
1596,she said okay this stanza here needs to
1597,sheet back to the notebook so there is a
1598,she's a special woman she is
1599,she's the one who says okay here's what
1600,should have said or ways to connect
1601,should I talked to Daniel Orosco a lot
1602,should if I'd had to completely retype
1603,shut up
1604,side into the poems and those kinds of
1605,similar to this and that was how I
1606,simple way of explaining it her simple
1607,simplicity I mean what I really I don't
1608,simultaneously the the arc of my career
1609,since 1972
1610,since since moon in a mason jar that
1611,Singh that issue up there the Obama
1612,six poems in the title of what I
1613,slowness of the process writing my
1614,Smithsonian wanted to see if all Lizzie
1615,snakes lives and the animals earthly
1616,snakes yeah which is a very sound driven
1617,snippets which I find myself compelled
1618,so about 2007
1619,so and to that extent I guess I
1620,so are you kidding me you should you're
1621,so begin to know what the second book
1622,so forth that show me opportunities to
1623,so get back to sort of the general Greek
1624,so I didn't dress up if Allah is the
1625,so I get some sort of I mean we're sort
1626,so I guess so we've seen a fetus finder
1627,so I knew which was which and when was
1628,so I know exactly which I can go back
1629,so i'm i don't leave tilt so i put in
1630,so knock yours out here yeah see brink
1631,so much of the sort of the professional
1632,so okay so you're just saying you back
1633,so since reign of snakes we got that one
1634,so then I guess overall that if we can
1635,so they don't they don't clutter up or
1636,so yeah so I'm sorry
1637,soilless she puts up just oh I think I'm
1638,some of its going to be repetitive so if
1639,some piece that I might resurrect and
1640,some seem important enough to print off
1641,some sense and even then I might just a
1642,some things for me but mostly no I don't
1643,some through it look for a poem or look
1644,some ways because I mean you know I
1645,someday people keep telling me I should
1646,somehow it seems I mean I never have
1647,somehow yeah it makes every week let you
1648,someone could go through and actually
1649,someone were really interested in were
1650,something but what they're really about
1651,something eventually is going to
1652,something go slide and I just turned
1653,something I didn't quite have the
1654,something I'd been doing all along
1655,something I've seen outside the outside
1656,something not so much the thing as the
1657,something oh yeah I forgot about this
1658,something some phrase or word out of
1659,something sometimes with my mom but most
1660,something that might last but you know
1661,something that once you've said that to
1662,something that you came to realize you
1663,something that you got ahold here yeah I
1664,something that's the supporting eight
1665,sometimes at a kitchen table you never
1666,sometimes it's like we'll have to do
1667,sometimes seemed kind of odd or they'd
1668,sometimes the bulk of the poem and
1669,sometimes those things get so tangled up
1670,somewhat constant in that or like like
1671,somewhere along the line I began to
1672,somewhere around 2000 late 2008 Ott's
1673,somewhere but I would not even remember
1674,somewhere faster or so it seems
1675,somewhere I think they're in a box in
1676,somewhere if people hate you
1677,sonnets I think I've published two in
1678,sonnets right on yeah I mean I've done
1679,sort of circumscribing what the poem is
1680,sort of I have a system and I suppose if
1681,sort of I mean you call much a little
1682,sort of liked the idea that I that the
1683,sort of meant to be more gone through
1684,sort of moving into organizing the
1685,sort of noodle around the way out you
1686,sort of pressing business do you think
1687,sort of questions late you know with
1688,sort of staggering to to try to remember
1689,sort of sticking them to one side yeah
1690,sort of there's something about a tat of
1691,sort of went old-fashioned on myself and
1692,sought out information about methods for
1693,sound it's for me a compositional tool I
1694,sounds fine to me
1695,southern Illinois University at
1696,space he said the desk I said I I
1697,space to write it I had this one or the
1698,space which probably would have been
1699,split the job and each talked to two and
1700,squeeze it see the silence and metal in
1701,stable work that's been published you
1702,start about your writing process
1703,start actively composing and composing
1704,start getting getting movement toward a
1705,start putting words on paper so that's
1706,start using a computer to do these
1707,start where there's like things that it
1708,started and go in for lunch about
1709,started out in Edinburgh in Scotland
1710,started writing down does it like you
1711,Steakhouse hill right over here how 95
1712,step of writing my hand then going to
1713,sticky wicket Hugo like that this
1714,still alive pushing 80 was really kind
1715,still allowed the the word processing
1716,still found a way to make its structure
1717,still got the poems so I can tell me
1718,still I mean I've got almost all the I
1719,still I need to win another prize I
1720,stitch those things together in the
1721,store individual poems for the
1722,storybook thing that happened that I
1723,strangers vets amputees just you know
1724,structure or about its its movement that
1725,students that I'm gonna hate to revise I
1726,studies in American and English
1727,studio the lens that is my eyes an
1728,study what you've done documents like
1729,stuffing what this is telling us yeah
1730,submitting a poll I just sent a poem
1731,substantial electronic presence
1732,substituted sort of mode as well it's a
1733,subtractive and pounding for de creus
1734,success I really don't need to be in any
1735,summary thought or folder which backs up
1736,surprise myself for how to do those
1737,swallowed me and I had to escape from
1738,Swift with the computer than it ever
1739,switch sometimes though I mean you
1740,syllabic line just to just to force me
1741,syllables I like composing say a deck of
1742,syllables more when you're writing it
1743,syllables of the subsequent line just to
1744,take a few photographs document
1745,take the shotgun out and blast out of
1746,take them for about a hundred two
1747,talk about that ago some questions later
1748,talked about having an external hard
1749,talking about how you probably take your
1750,talking about in volume a different
1751,talking talking about poems because some
1752,taught the bridge and you know they both
1753,teacher but a magnificent teacher he
1754,teaching a couple classes for that year
1755,teaching and the sort of advent of the
1756,teaching at LC so I've published ring of
1757,teaching maybe insofar as what I love
1758,techniques class of tried teaching in
1759,techniques or formats that you were able
1760,technology we well it's inescapable at
1761,tell I probably have 250 of these piled
1762,telling me and it'll back and get that
1763,ten it varies depends on what else is
1764,terms of of writing north of living in
1765,test with the computer I mean just
1766,text on the computer which I would then
1767,text to text on the computer screen and
1768,than it is now
1769,than it was now but or maybe it hasn't
1770,that act of laying them out on the floor
1771,that are going to be really really
1772,that are you revising towards like Ida
1773,that box I go through a poem by Palmer
1774,that can allow me to make a stitch here
1775,that computer will automatically do all
1776,that connects those two things so across
1777,that does concern me and then despair I
1778,that for years I started 1995 and and
1779,that I can break so it's it's a that I
1780,that I had a big marble Oh book end at
1781,that I not sort of run the line on too
1782,that I'll look at even at homes of
1783,that in some ways
1784,that in the beginning
1785,that interests me a whole lot more than
1786,that is
1787,that is to say that the period at the
1788,that it's you're guaranteed basically
1789,that just turns on a switch that just
1790,that kind of response to a poll you got
1791,that little sonic wind sprint as I
1792,that part of the process when the
1793,that point in my life or my career as a
1794,that really change anything I don't you
1795,that should make it that much more
1796,that sort of idea changed over years of
1797,that sort of show that process how that
1798,that sort of thing
1799,that stuff for you I don't think that it
1800,that that that part of the technology of
1801,that that that what is now the last poem
1802,that that's either things that have been
1803,that that's that's both the downside
1804,that the Tom was probably confusing or I
1805,that they can they only have to call you
1806,that thing just looking up and watching
1807,that this is
1808,that was in Montana baya they Matylda
1809,that was Kim's idea - I couldn't write
1810,that was one of the great things about
1811,that was really kind of a that I helped
1812,that way but then I don't yeah because I
1813,that whatever sort of disposition I have
1814,that's actually tremendously good advice
1815,that's amazing you know that's good
1816,that's been about it I don't really and
1817,that's here that we'll get to that
1818,that's just a great luxury Seattle yeah
1819,that's just my way of inviting what was
1820,that's just silly why would why would
1821,that's my business file and my personal
1822,that's number one number three and
1823,that's sort of either your main focus or
1824,that's useful and I can build with um
1825,that's when I really got started on it
1826,the
1827,the book because something was missing
1828,the book every one of the publishers
1829,the book if you know what I mean seems
1830,the book is going to be this is how it's
1831,the books and as he said to me and I
1832,the books and reading which was your
1833,the bulk of the composition on the
1834,the class on a kind of lark thinking how
1835,the cloud yeah and and that's it and
1836,the computer and then going back to the
1837,the computer helps to facilitate it
1838,the computer you were using the
1839,the difference between two files as one
1840,the file I'm sure I I one welcome
1841,the first I don't I think I was on
1842,the first little Oh cat pass go over to
1843,the first part of earthly meditations I
1844,the first quatrain ended with a period
1845,the first time I started leaving out the
1846,the handwriting and put things down
1847,the house and they're they're just the
1848,the in process folder that little thesis
1849,the in the screen that becomes success
1850,the individual poems as I find ways to
1851,the internet so I mean it's it's a
1852,the Italian octave I like a BBA a BBA
1853,the law a long sequence of poems called
1854,the life side maybe less so on the
1855,the line is for me separable from what I
1856,the lines were but that also required
1857,the Mac
1858,the Mac to just so I can back things up
