start,end,line
0:42:34.410,0:42:42.26,interesting but what I heard was um

0:42:37.380,0:42:45.28,all those glacial floods what happened

0:42:42.269,0:42:48.32,and they basically wash all these bones

0:42:45.289,0:42:50.78,over and fall there be like this giant

0:42:48.329,0:42:53.03,phone bed of you know 20 different

0:42:50.789,0:42:55.49,species but just because they've been

0:42:53.039,0:43:03.46,washed by the floods like that yeah up

0:42:55.499,0:43:06.83,the same place I just read those words I

0:43:03.469,0:43:09.35,guess then what a couple more questions

0:43:06.839,0:43:11.03,what revision but some and then so I

0:43:09.359,0:43:12.53,guess one of the like I've been reading

0:43:11.039,0:43:14.00,this book called the work of revision

0:43:12.539,0:43:15.39,which is a really interesting book kind

0:43:14.009,0:43:16.94,of tracing the history of revision so

0:43:15.390,0:43:19.43,much romantics up through the modernist

0:43:16.949,0:43:23.36,period and then kind of how textual

0:43:19.439,0:43:24.68,critisism works with it but and she was

0:43:23.369,0:43:26.36,sort of earnings Hannah Sullivan wrote

0:43:24.689,0:43:29.45,and she was sort of delineating kind of

0:43:26.369,0:43:30.71,three modes of vision one being a

0:43:29.459,0:43:32.36,creative like

0:43:30.719,0:43:34.14,joyce adding all the stuff Pacifica and

0:43:32.369,0:43:38.18,the other parts of the other season it's

0:43:34.140,0:43:39.50,the sort of excitable subtractive way

0:43:38.189,0:43:41.57,that you seem to do and then there's

0:43:39.509,0:43:43.28,that sort of substitution and I'm

0:43:41.579,0:43:45.23,wondering if their primary mode between

0:43:43.289,0:43:46.77,those three that you use for your

0:43:45.239,0:43:52.96,revision or is

0:43:46.770,0:43:57.94,combination hmm I would say I I really

0:43:52.960,0:44:01.69,kind of start with the excretion first

0:43:57.940,0:44:05.20,yeah and then go into the subtraction

0:44:01.690,0:44:07.11,and then probably this substitution it's

0:44:05.200,0:44:10.45,like the pink ring I do at the very end

0:44:07.119,0:44:12.46,okay and physically where where do these

0:44:10.450,0:44:14.29,processes happen I mean like you're

0:44:12.460,0:44:16.84,taking this way by having in the

0:44:14.290,0:44:19.50,notebook what does that happen on the

0:44:16.840,0:44:25.27,computer or that happen in those spaces

0:44:19.500,0:44:28.86,usually I've excised much of what I was

0:44:25.270,0:44:30.70,going to take out before I type it up so

0:44:28.869,0:44:34.24,I probably as I said I'll probably do

0:44:30.700,0:44:37.21,two or three handwritten drafts and I'll

0:44:34.240,0:44:40.36,rip actually rip the notebook page out

0:44:37.210,0:44:42.40,or and I have snow books and notebooks

0:44:40.360,0:44:45.70,where I I have a big X through the page

0:44:42.400,0:44:47.68,to so that I do not get confused that

0:44:45.700,0:44:50.20,I'm actually done with this version now

0:44:47.680,0:44:52.03,there's a if I look hard enough in the

0:44:50.200,0:44:55.06,notebook there is a later version of the

0:44:52.030,0:44:56.65,pause but I so I throw the old ripped

0:44:55.060,0:45:00.46,out pages in the back of the notebook

0:44:56.650,0:45:04.65,and there's a newer version somewhere in

0:45:00.460,0:45:07.66,there but the older ones are fatter and

0:45:04.650,0:45:10.99,often I'm awful you know experimenting

0:45:07.660,0:45:16.99,with line breaks than to you know what's

0:45:10.990,0:45:18.88,the shape shaping issues and and so just

0:45:16.990,0:45:21.43,to confirm that you're doing that in the

0:45:18.880,0:45:23.95,notebook and then I'll book still so and

0:45:21.430,0:45:26.80,then I feel like when I move it to the

0:45:23.950,0:45:29.20,computer I'm sort of getting to a place

0:45:26.800,0:45:30.60,where I want to look at it there's

0:45:29.200,0:45:32.70,something I'm sure you're going to hear

0:45:30.609,0:45:35.74,this with lots of writers my age that

0:45:32.700,0:45:39.99,there's something about when you type it

0:45:35.740,0:45:44.10,up that starts to make it look and

0:45:39.990,0:45:49.48,permanent especially for me in terms of

0:45:44.109,0:45:55.27,the shape of the poem the the line

0:45:49.480,0:45:57.43,length especially in a poem I am less

0:45:55.270,0:46:00.04,inclined to fiddle with line lengths

0:45:57.430,0:46:03.52,once I've got it on the

0:46:00.040,0:46:05.41,on the computer I do that is but for

0:46:03.520,0:46:07.57,some reason it still feels easier for me

0:46:05.410,0:46:11.92,to do it on the page could like to stick

0:46:07.570,0:46:13.99,my slashes in there okay and so once

0:46:11.920,0:46:17.10,they're actually broken into lines on

0:46:13.990,0:46:18.46,the computer yeah you don't have you

0:46:17.109,0:46:22.72,don't feel like you still have that

0:46:18.460,0:46:25.06,freedom - well I do I do I do experiment

0:46:22.720,0:46:28.75,or you know something I'll go oh this is

0:46:25.060,0:46:34.50,15 lines it's so close to us on it I

0:46:28.750,0:46:37.45,don't I help it along you know so then

0:46:34.500,0:46:44.68,there should be like another times or 1,
0:46:37.450,0:46:47.44,money yeah okay so and then at that

0:46:44.680,0:46:49.51,point are the ponies ordered into the

0:46:47.440,0:46:52.00,way you would like them in the hotel not

0:46:49.510,0:46:52.93,never so how does that with that

0:46:52.000,0:46:57.18,processor

0:46:52.930,0:47:00.82,oh that's just another process of just

0:46:57.180,0:47:06.04,printing out all the poems and then just

0:47:00.820,0:47:10.51,living with them and that takes I know

0:47:06.040,0:47:16.74,maybe a year to maybe even longer

0:47:10.510,0:47:19.18,sometimes of experimenting with sections

0:47:16.740,0:47:21.69,you know the arrangement I'm working

0:47:19.180,0:47:27.35,right now in a book of prose poems and

0:47:21.690,0:47:33.03,I'm just really struggling with what's

0:47:27.359,0:47:35.38,what's even going to be in this book 1,
0:47:33.030,0:47:38.05,so there's there's a number so once you

0:47:35.380,0:47:39.79,get as a computer are you putting like

0:47:38.050,0:47:42.16,all the poems from windows look in one

0:47:39.790,0:47:46.60,word file say or are you putting them

0:47:42.160,0:47:50.83,individually um no I don't put I each

0:47:46.600,0:47:54.07,poem is its own file until I really

0:47:50.830,0:47:56.71,start to make the book as a book okay

0:47:54.070,0:47:58.60,until you're like so it's just

0:47:56.710,0:48:00.55,technically then you play call that file

0:47:58.600,0:48:03.01,whatever the title of the poem is yeah

0:48:00.550,0:48:10.00,and then save it saved in a folder with

0:48:03.010,0:48:12.36,my folder is called home al and there

0:48:10.000,0:48:13.30,are some subfolders in their labors

0:48:12.369,0:48:15.16,um

0:48:13.300,0:48:17.71,for a book would you make us a folder

0:48:15.160,0:48:20.98,then or well then each book gets its own

0:48:17.710,0:48:22.78,file then okay yeah okay but it's so the

0:48:20.980,0:48:24.88,poems are kind of in one day folder and

0:48:22.780,0:48:27.13,then as they calculate into a book that

0:48:24.880,0:48:29.53,will be 1/5 exactly and if it when they

0:48:27.130,0:48:32.26,get published and I put them in another

0:48:29.530,0:48:34.69,file called published poems okay so I

0:48:32.260,0:48:38.38,don't get don't get confused and not

0:48:34.690,0:48:40.36,spending yeah so yeah and then there's

0:48:38.380,0:48:47.05,some old you know I have filed called

0:48:40.360,0:48:50.35,files called pawns Oh ate better just

0:48:47.050,0:48:52.63,like I'm never going to probably do

0:48:50.350,0:48:58.18,anything with them now but they're still

0:48:52.630,0:48:59.53,sitting there and is that the same that

0:48:58.180,0:49:07.66,same sort of transfer happened with

0:48:59.530,0:49:12.69,fiction - um yeah I mean I've got a file

0:49:07.660,0:49:16.36,in there just called stories in process

0:49:12.690,0:49:23.77,and I don't know if they're going to be

0:49:16.360,0:49:25.51,a book yeah and so we'll get back to

0:49:23.770,0:49:27.73,computer stuff a little bit more let me

0:49:25.510,0:49:28.87,just sort of talk a little bit move from

0:49:27.730,0:49:31.54,revision and talk a little bit more

0:49:28.870,0:49:32.89,about kind of organizational and if

0:49:31.540,0:49:40.66,we're already kind of talking about it

0:49:32.890,0:49:44.14,these things also mention any but so I

0:49:40.660,0:49:45.88,mean well okay but with the computer

0:49:44.140,0:49:47.62,then you know you move from your

0:49:45.880,0:49:49.06,notebook and then you type it up and is

0:49:47.620,0:49:51.91,that that sort of a moment of revision

0:49:49.060,0:49:53.56,for you - and then you have several

0:49:51.910,0:49:55.75,other different moments of revision when

0:49:53.560,0:49:57.19,it's on the computer but some of those

0:49:55.750,0:50:00.01,happen in paper because you print them

0:49:57.190,0:50:02.29,out right and then that's that

0:50:00.010,0:50:07.21,arrangement happens physically usually

0:50:02.290,0:50:10.48,first and oh look I will look at it I'll

0:50:07.210,0:50:12.10,come back to it over a period of a I

0:50:10.480,0:50:13.92,don't know a couple of weeks on the

0:50:12.100,0:50:17.41,computer then once it's in a computer

0:50:13.920,0:50:19.21,file and look at it probably tinker with

0:50:17.410,0:50:20.65,it a little bit more before and then

0:50:19.210,0:50:23.68,I'll start sending it out probably

0:50:20.650,0:50:26.26,scooter so fairly soon after I type it

0:50:23.680,0:50:30.49,up maybe a month too

0:50:26.260,0:50:33.55,yeah I there comes a point where I feel

0:50:30.490,0:50:34.78,like I'm making it worse yeah yeah my

0:50:33.550,0:50:37.15,tinkering is starting to make it worse

0:50:34.780,0:50:45.55,that's the only thing that stops me and

0:50:37.150,0:50:48.30,then I start sending it out and it's our

0:50:45.550,0:50:51.73,book right now no just individual poems

0:50:48.300,0:50:53.29,and then if it comes back rejected often

0:50:51.730,0:50:57.57,I'll tinker a little bit more and send

0:50:53.290,0:50:59.71,it back out again so you use the sort of

0:50:57.570,0:51:05.61,publication and submission process as a

0:50:59.710,0:51:05.61,sort of revision proper I do okay hmm

0:51:06.150,0:51:11.74,and then so okay then they come together

0:51:09.070,0:51:13.39,in one file as your focal saying in

0:51:11.740,0:51:15.37,between and that out and then the

0:51:13.390,0:51:17.44,publishers and it's a similar sort of

0:51:15.370,0:51:19.87,thing accusative subjective you can

0:51:17.440,0:51:21.25,revise again or that sort of once it's

0:51:19.870,0:51:22.96,in that file once you've got it there

0:51:21.250,0:51:29.59,you just sort of want to get to give it

0:51:22.960,0:51:31.54,a see um I hope probably revise it a

0:51:29.590,0:51:36.28,little bit more if it comes back

0:51:31.540,0:51:37.21,rejected but usually once it skips in

0:51:36.280,0:51:41.47,book form

0:51:37.210,0:51:44.53,um yeah it seems sort of settled to me

0:51:41.470,0:51:47.74,and often that this may be a awful the

0:51:44.530,0:51:49.81,case um the reason for that being that

0:51:47.740,0:51:53.05,I've probably moved on to another book

0:51:49.810,0:51:57.01,about it and that's another don't work

0:51:53.050,0:51:59.53,yeah yeah no an actual and I'm actually

0:51:57.010,0:52:04.42,compiling another book at that point

0:51:59.530,0:52:07.09,when I start to me one out and how many

0:52:04.420,0:52:09.34,books do you usually have going how many

0:52:07.090,0:52:11.80,projects at one time you usually have

0:52:09.340,0:52:15.07,two well I almost always have a book of

0:52:11.800,0:52:17.41,poems yes in process that I'm working on

0:52:15.070,0:52:20.88,like I said right now we'll keep trying

0:52:17.410,0:52:23.20,to shape up this book of prose poems and

0:52:20.880,0:52:26.46,then I almost always have a book of

0:52:23.200,0:52:30.67,fiction that's in process right now I'm

0:52:26.460,0:52:35.14,working on a ebooks novel novella thing

0:52:30.670,0:52:37.72,and and then you know I'm doing the

0:52:35.140,0:52:40.03,photos and also in terms of like

0:52:37.720,0:52:44.62,publishing individual pieces

0:52:40.030,0:52:47.68,I'm really doing those a lot okay

0:52:44.620,0:52:49.48,and then so in terms of just sort of

0:52:47.680,0:52:51.58,saving and archiving in your work

0:52:49.480,0:52:53.44,you think we talked a little bit about

0:52:51.580,0:52:57.10,this to keep your notebooks basically in

0:52:53.440,0:52:59.29,boxes on the shelf and then your files

0:52:57.100,0:53:00.85,are in a folder and they just stay in

0:52:59.290,0:53:04.39,the same folder and you put them to an

0:53:00.850,0:53:07.27,external drive yep importantly is there

0:53:04.390,0:53:08.80,any other kind of archival or backup

0:53:07.270,0:53:16.78,procedures that you go through for your

0:53:08.800,0:53:19.45,work or is that pretty much yes I guess

0:53:16.780,0:53:25.69,that's pretty much it I mean my

0:53:19.450,0:53:28.87,publishers I think have copies you know

0:53:25.690,0:53:34.54,they have PDF yeah of everything right

0:53:28.870,0:53:44.74,so I rely on them but those are not

0:53:34.540,0:53:48.16,going to go away I don't they send me to

0:53:44.740,0:53:50.98,prove now yes yeah okay and they used to

0:53:48.160,0:53:53.16,send you galleys or or pretty though

0:53:50.980,0:53:55.96,yeah huh

0:53:53.160,0:53:57.67,and where do you do much revision in the

0:53:55.960,0:54:02.67,best days not that one they don't like

0:53:57.670,0:54:04.99,it okay yeah yeah okay so then I guess

0:54:02.670,0:54:06.25,one question more and then I want to

0:54:04.990,0:54:09.40,talk kind of about computers

0:54:06.250,0:54:11.74,specifically but do you see kind of a

0:54:09.400,0:54:12.91,Miss talking listed is there was there

0:54:11.740,0:54:14.56,sort of thing you kind of delineate

0:54:12.910,0:54:16.60,stages in your own writing over the

0:54:14.560,0:54:18.69,course of your you know your stupid

0:54:16.600,0:54:20.80,writing so professionally do you see

0:54:18.690,0:54:27.28,distinct stages or do you think it's

0:54:20.800,0:54:29.61,just been kind of gradual you mean

0:54:27.280,0:54:31.87,that's where things have just changed

0:54:29.610,0:54:33.28,dramatically or like you know they could

0:54:31.870,0:54:34.93,have changed over like a couple of years

0:54:33.280,0:54:36.10,but I mean I could you can't would you

0:54:34.930,0:54:38.20,say there are stages or would you just

0:54:36.100,0:54:39.64,see it kind of and if there were

0:54:38.200,0:54:41.38,anything that kind of prompted some

0:54:39.640,0:54:42.64,changes well for those I guess it's

0:54:41.380,0:54:46.94,where I'm kind of filling

0:54:42.640,0:54:51.77,well I think it's mostly been gradual

0:54:46.940,0:54:55.58,that I've I've grown more comfortable

0:54:51.770,0:54:59.00,doing some revision work on the computer

0:54:55.580,0:55:01.22,and especially with the fiction and

0:54:59.000,0:55:07.49,maybe because fiction is still feels

0:55:01.220,0:55:11.10,like a newer form to me one shift that

0:55:07.490,0:55:15.23,has felt a little bit more dramatic with

0:55:11.109,0:55:18.94,composing is that I have found myself

0:55:15.230,0:55:24.08,and I'm working on short stories

0:55:18.940,0:55:26.54,actually doing some new composing work

0:55:24.080,0:55:31.01,right here while I'm sitting there like

0:55:26.540,0:55:35.69,out I'll be working on a story you know

0:55:31.010,0:55:39.85,thinking I'm typing in from my notebook

0:55:35.690,0:55:43.13,and actually I remember working on this

0:55:39.859,0:55:45.61,one story and I had written them

0:55:43.130,0:55:49.43,something a note to myself in my

0:55:45.619,0:55:52.33,notebook that said flush out her dream

0:55:49.430,0:55:54.32,right here and I had forgotten to do

0:55:52.339,0:55:59.18,that so I remember sitting here doing it

0:55:54.320,0:56:02.78,while I was typing in the story on this

0:55:59.180,0:56:04.45,into my word file and I thought when I

0:56:02.780,0:56:08.48,wrote was okay

0:56:04.450,0:56:11.51,and it sort of freed me up then to do

0:56:08.480,0:56:15.41,that more frequently to let myself do

0:56:11.510,0:56:17.42,some of the initial composing although I

0:56:15.410,0:56:20.15,still kind of like have a little cue

0:56:17.420,0:56:21.77,that what it's going to be you know like

0:56:20.150,0:56:25.13,there's a little hole that I forgot to

0:56:21.770,0:56:29.30,do or and I have a note to myself in the

0:56:25.130,0:56:31.91,notebook okay so do that I guess how

0:56:29.300,0:56:34.67,does was the difference in feel between

0:56:31.910,0:56:36.68,I guess Barry doesn't care does writing

0:56:34.670,0:56:40.45,with two-handed writing versus one yeah

0:56:36.680,0:56:43.73,what one of the things that I like about

0:56:40.450,0:56:49.25,doing it on the computer is I can close

0:56:43.730,0:56:52.43,my eyes which isn't really odd but I

0:56:49.250,0:56:53.54,like it and so it seems to lend itself

0:56:52.430,0:56:58.07,to

0:56:53.540,0:57:00.76,whoo somewheres not to dialogues or

0:56:58.070,0:57:04.28,actions but to real kind of interior

0:57:00.760,0:57:06.86,moments where I'm in a character's mind

0:57:04.280,0:57:08.99,and I want to replicate our thinking

0:57:06.860,0:57:10.58,process like I said what's the first

0:57:08.990,0:57:13.67,time I ever tried it was where I kind of

0:57:10.580,0:57:16.40,tried to render a dream but the

0:57:13.670,0:57:18.50,character had had so I close my eyes you

0:57:16.400,0:57:21.53,know he's Corsican type of rifle right

0:57:18.500,0:57:26.02,but I can't write with my icicle okay

0:57:21.530,0:57:26.02,you really invertible yeah yeah yeah

0:57:28.840,0:57:36.11,okay so in terms of computers generally

0:57:32.840,0:57:39.83,when did you when did they enter into

0:57:36.110,0:57:41.54,your writing process well when I I

0:57:39.830,0:57:42.92,remember when I moved to Lake Forest

0:57:41.540,0:57:44.21,College I knew were going to ask me this

0:57:42.920,0:57:47.84,I was trying to think about this the

0:57:44.210,0:57:52.82,other day and we got these when I wish I

0:57:47.840,0:57:56.00,could k-pro favorite okay have you heard

0:57:52.820,0:58:01.34,of those no oh my god they were these

0:57:56.000,0:58:08.99,huge grey boxes and they were given to

0:58:01.340,0:58:12.56,us this must have been 1980 right around

0:58:08.990,0:58:14.84,there 1980 at Lake Forest College all

0:58:12.560,0:58:17.69,the faculty got these k-pro computer

0:58:14.840,0:58:22.88,things and really all they did was word

0:58:17.690,0:58:24.92,processing so but I liked him I remember

0:58:22.880,0:58:28.07,a lot of the faculty were complaining

0:58:24.920,0:58:30.05,but I believe you know because I was

0:58:28.070,0:58:33.77,moving from I like a Selectric

0:58:30.050,0:58:36.17,typewriter something and this machine

0:58:33.770,0:58:39.80,was so much easier to do corrections and

0:58:36.170,0:58:41.60,everything yeah and so I took to the

0:58:39.800,0:58:44.87,computer right away I really liked it

0:58:41.600,0:58:47.69,you making me yeah okay that's very

0:58:44.870,0:58:48.98,really well I can't remember the exact

0:58:47.690,0:58:51.95,here somewhere I mean you started

0:58:48.980,0:58:53.78,teaching in Lake Forest in 79 so it was

0:58:51.950,0:58:55.91,right around there when we first moved

0:58:53.780,0:58:58.58,there yeah and that's all they did they

0:58:55.910,0:59:01.72,didn't do there was no internet or right

0:58:58.580,0:59:05.02,yeah we were just just WordPerfect yeah

0:59:01.720,0:59:05.02,did this

0:59:05.590,0:59:10.21,well the advent of this computer and

0:59:08.080,0:59:11.98,then maybe like the kind of more

0:59:10.210,0:59:13.96,prevalence of computers kind of change

0:59:11.980,0:59:19.39,your writing practices pretty

0:59:13.960,0:59:23.22,drastically eventually or well and the

0:59:19.390,0:59:27.34,you know the academic world I don't know

0:59:23.220,0:59:30.82,if I hadn't been in the Academy if I

0:59:27.340,0:59:33.85,would be have the same relationship with

0:59:30.820,0:59:36.37,technology as I do because everywhere I

0:59:33.850,0:59:39.09,went to teach I was presented with a new

0:59:36.370,0:59:44.31,computer when I walked in the door and

0:59:39.090,0:59:50.05,and it's nice and because you know Apple

0:59:44.310,0:59:52.51,made its money by habituation habitual I

0:59:50.050,0:59:55.36,seen people with Lauren trying to say no

0:59:52.510,0:59:57.88,to their to their technology yes that's

0:59:55.360,1:00:00.31,how they became so great you know you

0:59:57.880,1:00:02.35,know get all these freshmen hooked on

1:00:00.310,1:00:04.69,apples when they're in college because

1:00:02.350,1:00:06.25,they're in the labs and then the next

1:00:04.690,1:00:10.63,thing you know you've got generations

1:00:06.250,1:00:13.57,out there and so anyway I am the total

1:00:10.630,1:00:17.02,Mac person I love them I think they seem

1:00:13.570,1:00:19.81,really intuitive to me to use them but

1:00:17.020,1:00:24.04,and but I've grown up with them great I

1:00:19.810,1:00:25.66,mean so and then I guess what about the

1:00:24.040,1:00:27.85,software that you used you started with

1:00:25.660,1:00:31.11,the sort of basic word processing did

1:00:27.850,1:00:34.72,you move to an Apple word processing

1:00:31.110,1:00:38.23,software or was it like WordPerfect or

1:00:34.720,1:00:40.21,you remember I mean I can't even me no

1:00:38.230,1:00:41.86,no gosh I'm not going to be able to

1:00:40.210,1:00:44.02,remember all the different program names

1:00:41.860,1:00:46.51,but yeah and now are using Microsoft

1:00:44.020,1:00:49.51,Word uh-huh okay but you're also using

1:00:46.510,1:00:51.55,pages yeah so so you're looking between

1:00:49.510,1:00:55.54,software there has that been a newer

1:00:51.550,1:00:58.24,thing since the iPad or yeah I may get a

1:00:55.540,1:01:00.39,new iPad pretty soon up and I don't I

1:00:58.240,1:01:03.37,don't know if I want to buy another

1:01:00.390,1:01:06.13,Microsoft Word you know yeah I'm getting

1:01:03.370,1:01:09.01,agencies next time yeah it moves can't

1:01:06.130,1:01:15.68,afford to find great great

1:01:09.010,1:01:18.36,but I learned um Photoshop okay

1:01:15.680,1:01:23.43,when I was magazine editor

1:01:18.360,1:01:24.06,I edited Willow Springs for about six

1:01:23.430,1:01:27.15,years

1:01:24.060,1:01:29.22,and so I've learned that what's in 199,
1:01:27.150,1:01:31.58,he took over the editorship of that

1:01:29.220,1:01:36.80,magazine when I came out to Eastern and

1:01:31.580,1:01:40.07,they they were doing the magazine with

1:01:36.800,1:01:43.17,there was null computer technology the

1:01:40.070,1:01:49.74,woman who had done it before me was like

1:01:43.170,1:01:51.57,she was into the light board thing which

1:01:49.740,1:01:54.78,I had learnt which I had learned in

1:01:51.570,1:01:57.72,college I in journalism class you know

1:01:54.780,1:01:59.76,with the sticky pili thing you really

1:01:57.720,1:02:02.43,like you I actually saw this in high

1:01:59.760,1:02:05.10,school in my journalism class - yes and

1:02:02.430,1:02:08.79,I could not believe that that they had

1:02:05.100,1:02:11.52,no computer program or anything so a guy

1:02:08.790,1:02:14.49,in the journalism department gave me a

1:02:11.520,1:02:16.50,copy page maker to put on the computer

1:02:14.490,1:02:22.23,and I instantly fell in love with it

1:02:16.500,1:02:24.03,yeah I just oh I loved us I love doing

1:02:22.230,1:02:26.13,the art for the magazine I did the

1:02:24.030,1:02:28.74,covers you know I mean I found the art

1:02:26.130,1:02:32.00,and made the covers myself because there

1:02:28.740,1:02:35.46,was nobody else to do it right and so I

1:02:32.000,1:02:38.25,learned pagemaker at the very beginning

1:02:35.460,1:02:42.53,when it was just out and then she

1:02:38.250,1:02:45.84,probably know that became social so I

1:02:42.530,1:02:49.59,just kind of stayed with it on all these

1:02:45.840,1:02:56.91,years and now easily sorted out this one

1:02:49.590,1:02:59.73,of years Wow and you know I buy every

1:02:56.910,1:03:01.53,other Photoshop fests that's been my mo

1:02:59.730,1:03:05.64,I don't try to keep up with every single

1:03:01.530,1:03:07.86,new one so I'm on five now but I will

1:03:05.640,1:03:08.88,probably get seven with I'm a little

1:03:07.860,1:03:10.23,worried that they're not going to do

1:03:08.880,1:03:12.72,that anymore they seem to be moving

1:03:10.230,1:03:15.72,sabbatical a subscription basis you

1:03:12.720,1:03:17.22,really yeah how do you mean well you

1:03:15.720,1:03:20.58,know we buy it a lot for the digital

1:03:17.220,1:03:22.20,secures and I'm starting to hear that

1:03:20.580,1:03:23.88,there's you know they're offering it now

1:03:22.200,1:03:25.04,season you know basically pay a monthly

1:03:23.880,1:03:27.70,fee and get photos

1:03:25.049,1:03:30.95,or get in design or get the design suite

1:03:27.709,1:03:31.97,but that so I'm not sure how often if

1:03:30.959,1:03:34.04,they're going to be selling those like

1:03:31.979,1:03:34.64,student teachers kind of additions

1:03:34.049,1:03:36.32,anymore

1:03:34.649,1:03:38.72,Oh or if they're going to be charging a

1:03:36.329,1:03:39.77,subscription fee which in my mind is

1:03:38.729,1:03:41.18,going to be windmill expensive

1:03:39.779,1:03:42.41,assistance as we have so many topics it

1:03:41.189,1:03:45.63,might be cheaper overall for an

1:03:42.419,1:03:47.51,individual but interesting yeah so I'm

1:03:45.630,1:03:49.70,not sure I'm not actually positive about

1:03:47.519,1:03:56.30,that but I sort of have heard on the

1:03:49.709,1:04:00.28,wind that might be no wow that was okay

1:03:56.309,1:04:02.78,it's a tax write-off oh yeah yeah yeah

